key	text	tooltip
armory_item_ui_infos_description_wh3_main_dae_cha_daemon_prince_legs_corpulent_2	Revolting pustules on the legs have burst open, revealing large spikes growing through the skin.	false
armory_item_ui_infos_description_wh3_main_dae_cha_daemon_prince_legs_corpulent_3	These legs are ridden with pestilence, where large buboes form, seeping with abhorrent odour and pus.	false
armory_item_ui_infos_description_wh3_main_dae_cha_daemon_prince_legs_corpulent_4	The potency of Nurgle's decay has affected even the leg armour, which has weakened and deteriorated with festering rot.	false
armory_item_ui_infos_description_wh3_main_dae_cha_daemon_prince_legs_corpulent_5	Slick with the same revolting ooze that drips from the skin, these light greaves do naught to obscure the stink.	false
armory_item_ui_infos_description_wh3_main_dae_cha_daemon_prince_legs_corpulent_6	The armour strains under the task of encompassing the whole leg, but provides adequate protection nonetheless.	false
armory_item_ui_infos_description_wh3_main_dae_cha_daemon_prince_legs_corpulent_7	The armour strains under the task of encompassing the whole leg; thorned spikes cause much pain for any attackers.	false
armory_item_ui_infos_description_wh3_main_dae_cha_daemon_prince_legs_daemonette_1	These pale, digitigrade legs are primarily unadorned, exposed entirely to the corrupting influence of Chaos.	false
armory_item_ui_infos_description_wh3_main_dae_cha_daemon_prince_legs_daemonette_2	Metal straps and jewellery adorn the legs, offering some small measure of protection and decoration.	false
armory_item_ui_infos_description_wh3_main_dae_cha_daemon_prince_legs_daemonette_3	Several horns and spikes sprout haphazardly from the skin, adorning the legs with a most deadly decoration.	false
armory_item_ui_infos_description_wh3_main_dae_cha_daemon_prince_legs_daemonette_4	Skulls and withered appendages are clasped to a belt at the waist, glorious trophies of battle and domination.	false
armory_item_ui_infos_description_wh3_main_dae_cha_daemon_prince_legs_daemonette_5	The legs remain mostly bare, but for the light greaves that ensure large expanses of skin remain displayed.	false
armory_item_ui_infos_description_wh3_main_dae_cha_daemon_prince_legs_daemonette_6	When the need for protection outweighs any salacious intent, heavy greaves are worn up to the hock of the leg. 	false
armory_item_ui_infos_description_wh3_main_dae_cha_daemon_prince_legs_daemonette_7	The legs remain mostly bare, but for the light greaves that ensure large expanses of skin remain displayed.	false
armory_item_ui_infos_description_wh3_main_dae_cha_daemon_prince_legs_daemonette_8	When the need for protection outweighs any salacious intent, heavy greaves are worn up to the hock of the leg.	false
armory_item_ui_infos_description_wh3_main_dae_cha_daemon_prince_tail_base_1	The spine leads into a Daemon tail, long and smooth to the touch.	false
armory_item_ui_infos_description_wh3_main_dae_cha_daemon_prince_tail_base_2	The tail is tipped by a lethal brass spike, able to strike with the force of any spear.	false
armory_item_ui_infos_description_wh3_main_dae_cha_daemon_prince_tail_base_3	Where the illuminating glow of the flame ends, the blackened, calcified flesh of the tail begins.	false
armory_item_ui_infos_description_wh3_main_dae_cha_daemon_prince_tail_base_4	Along the length of the tail grow brutal spines; fragments of bone so sharp they have forced their way through the skin.	false
armory_item_ui_infos_description_wh3_main_dae_cha_daemon_prince_tail_base_5	Like a living mace, lengthy spikes grow from the end of the tail that are capable of bludgeoning enemies and smashing their skulls into splinters.	false
armory_item_ui_infos_description_wh3_main_dae_cha_daemon_prince_tail_base_6	The tail is armoured, adding both protection and weight to its blunt and heavy strike. 	false
armory_item_ui_infos_description_wh3_main_dae_cha_daemon_prince_tail_corpulent_1	A fat, slug-like tail oozing with the rotten miasma of death and decay.	false
armory_item_ui_infos_description_wh3_main_dae_cha_daemon_prince_tail_corpulent_2	Eroded by its own rot, the armour shielding the tail is broken, decrepit and feeble.	false
armory_item_ui_infos_description_wh3_main_dae_cha_daemon_prince_tail_corpulent_3	Atop the slimy secretions of the tail is attached a layer of heavy armour for shelter.	false
armory_item_ui_infos_description_wh3_main_dae_cha_daemon_prince_tail_corpulent_4	Spikes rise above the layer of grime that coats the skin of the tail, their cut sure to leave behind sickness and malady.	false
armory_item_ui_infos_description_wh3_main_dae_cha_daemon_prince_tail_corpulent_5	Swollen pustules and buboes coat the tail, leaking the abhorrent and insidious corruption of Nurgle.	false
armory_item_ui_infos_description_wh3_main_dae_cha_daemon_prince_tail_corpulent_6	Each swollen and infected joint of the tail is wrapped with chains, where the broken skulls of past victims are tied, eternally dragging behind. 	false
armory_item_ui_infos_description_wh3_main_dae_cha_daemon_prince_tail_fiend_1	The tail is smooth and strong, and always poised as if ready to sting. 	false
armory_item_ui_infos_description_wh3_main_dae_cha_daemon_prince_tail_fiend_2	Decorative ringlets loop along the tail, promoting an air of fiendish finesse and allure.	false
armory_item_ui_infos_description_wh3_main_dae_cha_daemon_prince_tail_fiend_3	The scorpion-like appearance of the tail is only somewhat obscured by the plate armour attached along its length.	false
armory_item_ui_infos_description_wh3_main_dae_cha_daemon_prince_tail_fiend_4	The tail is shielded by an imposing armour of metal spikes, guarding it from the enemies of Chaos.	false
armory_item_ui_infos_description_wh3_main_dae_cha_daemon_prince_tail_fiend_5	Hooks and chains entwine around the tail, rusted and bloody from all manner of cruel delights.	false
armory_item_ui_infos_description_wh3_main_dae_cha_daemon_prince_tail_fiend_6	A scythe-like blade has mutated at the end of the tail, able to skewer enemies in one savage thrust.	false
armory_item_ui_infos_description_wh3_main_dae_cha_daemon_prince_tail_living_1	A hungry, malevolent mouth thrashes at the end of the tail, twisting and turning in search of easy prey.	false
armory_item_ui_infos_description_wh3_main_dae_cha_daemon_prince_tail_living_2	Plated in heavy armour, the tail is increasingly reckless in hungrily seeking its victims.	false
armory_item_ui_infos_description_wh3_main_dae_cha_daemon_prince_tail_living_3	The suffocating bind of chains has done little to quell the vicious nature of the tail.	false
armory_item_ui_infos_description_wh3_main_dae_cha_daemon_prince_tail_living_4	The destructive spines on this sentient tail make its hunger for mayhem all the easier to sate.	false
armory_item_ui_infos_description_wh3_main_dae_cha_daemon_prince_tail_living_5	Arrow heads and gouging scars devastate the tail, yet its relentless spite and hostility remain undiminished.	false
armory_item_ui_infos_description_wh3_main_dae_cha_daemon_prince_tail_living_6	The malevolent, bloodthirsty energy of Khorne permeates the tail, radiating from it in Chaotic waves of pure hate.	false
armory_item_ui_infos_description_wh3_main_dae_cha_daemon_prince_tail_snapping_1	An air of mystical sentience surrounds the tail, thrashing and snapping at will.	false
armory_item_ui_infos_description_wh3_main_dae_cha_daemon_prince_tail_snapping_2	Heavily plated with metal, the tail writhes uncontrollably wreaking havoc with its weight.	false
armory_item_ui_infos_description_wh3_main_dae_cha_daemon_prince_tail_snapping_3	The tail is decorated in ringlets and jewellery, though whether to the tastes of its owner or the tail itself remains unknown.	false
armory_item_ui_infos_description_wh3_main_dae_cha_daemon_prince_tail_snapping_4	Small, edged teeth grow across the tail, delivering a thousand cuts with a single swipe.	false
armory_item_ui_infos_description_wh3_main_dae_cha_daemon_prince_tail_snapping_5	Ferocious, snapping teeth fill the numerous mouths that line the tail, each one seeking to sate its own endless hunger.	false
armory_item_ui_infos_description_wh3_main_dae_cha_daemon_prince_tail_snapping_6	Magical Daemonic energy thrums along the tail, as iridescent and captivating as it is corrupting.	false
armory_item_ui_infos_description_wh3_main_dae_cha_daemon_prince_torso_adornedarmour_1	A lithe and graceful body of indeterminate gender, as powerful and abhorrent as it is strangely alluring.	false
armory_item_ui_infos_description_wh3_main_dae_cha_daemon_prince_torso_adornedarmour_2	Bloody carvings decorate the rent flesh of the body, twisting in chaotic patterns that honour the Dark Prince Slaanesh.	false
armory_item_ui_infos_description_wh3_main_dae_cha_daemon_prince_torso_adornedarmour_3	Both gleaming jewels and grisly trophies decorate the body, a testament of strength and prestige in the Realms of Chaos.	false
armory_item_ui_infos_description_wh3_main_dae_cha_daemon_prince_torso_adornedarmour_4	Pristine armour of heavy plate is sculpted to the body and shoulders, hugging every shape and curve.	false
armory_item_ui_infos_description_wh3_main_dae_cha_daemon_prince_torso_adornedarmour_5	Heavy armour that moulds to the body, leaving the shoulders bare.	false
armory_item_ui_infos_description_wh3_main_dae_cha_daemon_prince_torso_adornedarmour_6	The armour is thin and light, protecting little and covering up even less.	false
armory_item_ui_infos_description_wh3_main_dae_cha_daemon_prince_torso_base_1	The body is a wall of pure muscle, with the Mark of Chaos worn proudly on the chest.  	false
armory_item_ui_infos_description_wh3_main_dae_cha_daemon_prince_torso_base_10	Simple straps of leather armour protect the body, with thick pauldrons attached at the shoulders.	false
armory_item_ui_infos_description_wh3_main_dae_cha_daemon_prince_torso_base_2	As large and brutish as the Blood God himself, this body bears the searing Mark of Khorne. 	false
armory_item_ui_infos_description_wh3_main_dae_cha_daemon_prince_torso_base_3	With the Mark of Nurgle displayed clearly on the chest, this body is a conduit of death and decay.	false
armory_item_ui_infos_description_wh3_main_dae_cha_daemon_prince_torso_base_4	The perfectly-formed Mark of Slaanesh adorns the smooth, desirable skin of the chest.	false
armory_item_ui_infos_description_wh3_main_dae_cha_daemon_prince_torso_base_5	Imbued with terrible, arcane knowledge, the Mark of Tzeentch is borne as a stamp of pride on the body.	false
armory_item_ui_infos_description_wh3_main_dae_cha_daemon_prince_torso_base_6	Forming a cross on the chest, the dual leather straps make a taunting target for the enemies of Chaos.	false
armory_item_ui_infos_description_wh3_main_dae_cha_daemon_prince_torso_base_7	Small horns and spikes erupt from the skin, leaving a spiny trail across the body.	false
armory_item_ui_infos_description_wh3_main_dae_cha_daemon_prince_torso_base_8	The body is shielded by an armour of thick, heavy plate.	false
armory_item_ui_infos_description_wh3_main_dae_cha_daemon_prince_torso_base_9	Heavy armour protects the chest, while the lack of pauldrons reduces any limitation on mobility.	false
armory_item_ui_infos_description_wh3_main_dae_cha_daemon_prince_torso_bird_1	The body has morphed and mutated into a bird-like physique, with light tufts of feathers sprouting from the skin.	false
armory_item_ui_infos_description_wh3_main_dae_cha_daemon_prince_torso_bird_2	The weight of heavy jewellery is nothing to one who carries the weight of Tzeentch's dark knowledge.	false
armory_item_ui_infos_description_wh3_main_dae_cha_daemon_prince_torso_bird_3	Leather straps hold down the feathers growing along the torso in patches, providing a small amount of protection.	false
armory_item_ui_infos_description_wh3_main_dae_cha_daemon_prince_torso_bird_4	A heavy chest piece protects the slim avian physique.	false
armory_item_ui_infos_description_wh3_main_dae_cha_daemon_prince_torso_bird_5	Heavy plate chest armour and pauldrons provide maximum protection against all manner of weapons.	false
armory_item_ui_infos_description_wh3_main_dae_cha_daemon_prince_torso_bird_6	The deep runes carved into the body swirl and glow with magical energy. 	false
armory_item_ui_infos_description_wh3_main_dae_cha_daemon_prince_torso_brasscollar_1	Corruption leeches from the sharp metal spikes of the collar, leaving its dark infection glowing in its wearers veins. 	false
armory_item_ui_infos_description_wh3_main_dae_cha_daemon_prince_torso_brasscollar_2	Below the brass collar at the neck is worn a band of tough leather worn across the stomach, plated for added protection.	false
armory_item_ui_infos_description_wh3_main_dae_cha_daemon_prince_torso_brasscollar_3	Dual straps of leather and metal cross the chest, hiding little of the corrupting effects from the collar above.	false
armory_item_ui_infos_description_wh3_main_dae_cha_daemon_prince_torso_brasscollar_4	Metal plates line the body, welded into the skin and adorned with the gruesome trophies of death and victory.	false
armory_item_ui_infos_description_wh3_main_dae_cha_daemon_prince_torso_brasscollar_5	The collar rests uneasily between the large spines of bone that jut from the shoulders and back.	false
armory_item_ui_infos_description_wh3_main_dae_cha_daemon_prince_torso_brasscollar_6	Simple fur pauldrons protect the shoulders, attached to the Khornate brass collar tightly encircling the neck.	false
armory_item_ui_infos_description_wh3_main_dae_cha_daemon_prince_torso_corpulent_1	A gargantuan mass of flesh and rot, this body is rancid with decay. 	false
armory_item_ui_infos_description_wh3_main_dae_cha_daemon_prince_torso_corpulent_2	Spikes break out through the skin of the stomach, chest and back, dripping disease from every tip.	false
armory_item_ui_infos_description_wh3_main_dae_cha_daemon_prince_torso_corpulent_3	Large horns protrude from all across the body, poking out between grime-covered folds of fat.	false
armory_item_ui_infos_description_wh3_main_dae_cha_daemon_prince_torso_corpulent_4	Victims of Nurgle's disease and decay have their bones hung as trophies from the body.	false
armory_item_ui_infos_description_wh3_main_dae_cha_daemon_prince_torso_corpulent_5	Bearing deadly plague, the body is engulfed in hideous and swollen, pus-filled buboes.	false
armory_item_ui_infos_description_wh3_main_dae_cha_daemon_prince_torso_corpulent_6	Small bells bounce and ring loudly as the body bounds towards its next victim.	false
armory_item_ui_infos_description_wh3_main_dae_cha_daemon_prince_torso_magical_heavy_1	Pure Chaos exudes from the body in waves, releasing powerful magical energy.	false
armory_item_ui_infos_description_wh3_main_dae_cha_daemon_prince_torso_magical_heavy_2	The body burns with the raging fires of Khorne, the red mist of wrath enveloping the skin.	false
armory_item_ui_infos_description_wh3_main_dae_cha_daemon_prince_torso_magical_heavy_3	The dark and alluring energy of Slaanesh surrounds the body, pulsing in an aura of seduction.	false
armory_item_ui_infos_description_wh3_main_dae_cha_daemon_prince_torso_magical_heavy_4	The pungent miasma of filth and disease is released from the body; a cloud of Nurgle's pestilence infecting the surrounding area.	false
armory_item_ui_infos_description_wh3_main_dae_cha_daemon_prince_torso_magical_heavy_5	A swirling, cosmic radiance surrounds the body, wrapping the skin in the magic of Tzeentch.	false
armory_item_ui_infos_description_wh3_main_dae_cha_daemon_prince_torso_magical_heavy_6	Turbulent black smoke engulfs the body, partially shrouding it in its dark embrace.	false
armory_item_ui_infos_description_wh3_main_dae_cha_daemon_prince_torso_magical_medium_1	Pure Chaos exudes from the body in waves, releasing powerful magical energy.	false
armory_item_ui_infos_description_wh3_main_dae_cha_daemon_prince_torso_magical_medium_2	The body burns with the raging fires of Khorne, the red mist of wrath enveloping the skin.	false
armory_item_ui_infos_description_wh3_main_dae_cha_daemon_prince_torso_magical_medium_3	The dark and alluring energy of Slaanesh surrounds the body, pulsing in an aura of seduction.	false
armory_item_ui_infos_description_wh3_main_dae_cha_daemon_prince_torso_magical_medium_4	The pungent miasma of filth and disease is released from the body; a cloud of Nurgle's pestilence infecting the surrounding area.	false
armory_item_ui_infos_description_wh3_main_dae_cha_daemon_prince_torso_magical_medium_5	A swirling, cosmic radiance surrounds the body, wrapping the skin in the magic of Tzeentch.	false
armory_item_ui_infos_description_wh3_main_dae_cha_daemon_prince_torso_magical_medium_6	Turbulent black smoke engulfs the body, partially shrouding it in its dark embrace.	false
armory_item_ui_infos_description_wh3_main_dae_cha_daemon_prince_weapon_bloodletter_sword_1		false
armory_item_ui_infos_description_wh3_main_dae_cha_daemon_prince_weapon_bloodletter_sword_2		false
armory_item_ui_infos_description_wh3_main_dae_cha_daemon_prince_weapon_bloodletter_sword_3		false
armory_item_ui_infos_description_wh3_main_dae_cha_daemon_prince_weapon_bloodthirster_axe_1		false
armory_item_ui_infos_description_wh3_main_dae_cha_daemon_prince_weapon_bloodthirster_axe_2		false
armory_item_ui_infos_description_wh3_main_dae_cha_daemon_prince_weapon_bloodthirster_axe_3		false
armory_item_ui_infos_description_wh3_main_dae_cha_daemon_prince_weapon_bloodthirster_great_axe_1		false
armory_item_ui_infos_description_wh3_main_dae_cha_daemon_prince_weapon_bloodthirster_great_axe_2		false
armory_item_ui_infos_description_wh3_main_dae_cha_daemon_prince_weapon_bloodthirster_great_axe_3		false
armory_item_ui_infos_description_wh3_main_dae_cha_daemon_prince_weapon_chaos_knight_lance_1		false
armory_item_ui_infos_description_wh3_main_dae_cha_daemon_prince_weapon_chaos_knight_lance_2		false
armory_item_ui_infos_description_wh3_main_dae_cha_daemon_prince_weapon_chaos_knight_lance_3		false
armory_item_ui_infos_description_wh3_main_dae_cha_daemon_prince_weapon_chaos_knight_sword_1		false
armory_item_ui_infos_description_wh3_main_dae_cha_daemon_prince_weapon_chaos_knight_sword_2		false
armory_item_ui_infos_description_wh3_main_dae_cha_daemon_prince_weapon_chaos_knight_sword_3		false
armory_item_ui_infos_description_wh3_main_dae_cha_daemon_prince_weapon_chaos_shield_1		false
armory_item_ui_infos_description_wh3_main_dae_cha_daemon_prince_weapon_chaos_shield_2		false
armory_item_ui_infos_description_wh3_main_dae_cha_daemon_prince_weapon_chaos_shield_3		false
armory_item_ui_infos_description_wh3_main_dae_cha_daemon_prince_weapon_chaos_sorcerer_staff_1		false
armory_item_ui_infos_description_wh3_main_dae_cha_daemon_prince_weapon_chaos_sorcerer_staff_2		false
armory_item_ui_infos_description_wh3_main_dae_cha_daemon_prince_weapon_chaos_sorcerer_staff_3		false
armory_item_ui_infos_description_wh3_main_dae_cha_daemon_prince_weapon_chaos_sword_1		false
armory_item_ui_infos_description_wh3_main_dae_cha_daemon_prince_weapon_chaos_sword_2		false
armory_item_ui_infos_description_wh3_main_dae_cha_daemon_prince_weapon_chaos_sword_3		false
armory_item_ui_infos_description_wh3_main_dae_cha_daemon_prince_weapon_chaos_warrior_sword_1		false
armory_item_ui_infos_description_wh3_main_dae_cha_daemon_prince_weapon_chaos_warrior_sword_2		false
armory_item_ui_infos_description_wh3_main_dae_cha_daemon_prince_weapon_chaos_warrior_sword_3		false
armory_item_ui_infos_description_wh3_main_dae_cha_daemon_prince_weapon_chaos_warrior_sword_4		false
armory_item_ui_infos_description_wh3_main_dae_cha_daemon_prince_weapon_chaos_warrior_sword_5		false
armory_item_ui_infos_description_wh3_main_dae_cha_daemon_prince_weapon_chosen_halberd_1		false
armory_item_ui_infos_description_wh3_main_dae_cha_daemon_prince_weapon_chosen_halberd_2		false
armory_item_ui_infos_description_wh3_main_dae_cha_daemon_prince_weapon_chosen_halberd_3		false
armory_item_ui_infos_description_wh3_main_dae_cha_daemon_prince_weapon_cultist_club_1		false
armory_item_ui_infos_description_wh3_main_dae_cha_daemon_prince_weapon_cultist_club_2		false
armory_item_ui_infos_description_wh3_main_dae_cha_daemon_prince_weapon_doom_knight_lance_1		false
armory_item_ui_infos_description_wh3_main_dae_cha_daemon_prince_weapon_doom_knight_lance_2		false
armory_item_ui_infos_description_wh3_main_dae_cha_daemon_prince_weapon_doom_knight_lance_3		false
armory_item_ui_infos_description_wh3_main_dae_cha_daemon_prince_weapon_doom_knight_shield_1		false
armory_item_ui_infos_description_wh3_main_dae_cha_daemon_prince_weapon_doom_knight_shield_2		false
armory_item_ui_infos_description_wh3_main_dae_cha_daemon_prince_weapon_doom_knight_shield_3		false
armory_item_ui_infos_description_wh3_main_dae_cha_daemon_prince_weapon_dragon_ogre_hammer_1		false
armory_item_ui_infos_description_wh3_main_dae_cha_daemon_prince_weapon_dragon_ogre_hammer_2		false
armory_item_ui_infos_description_wh3_main_dae_cha_daemon_prince_weapon_dragon_ogre_hammer_3		false
armory_item_ui_infos_description_wh3_main_dae_cha_daemon_prince_weapon_dragon_ogre_hammer_4		false
armory_item_ui_infos_description_wh3_main_dae_cha_daemon_prince_weapon_dragon_ogre_shaggoth_axe_1		false
armory_item_ui_infos_description_wh3_main_dae_cha_daemon_prince_weapon_exalted_great_unclean_one_bell_1		false
armory_item_ui_infos_description_wh3_main_dae_cha_daemon_prince_weapon_exalted_keeper_of_secrets_shield_1		false
armory_item_ui_infos_description_wh3_main_dae_cha_daemon_prince_weapon_exalted_keeper_of_secrets_shield_2		false
armory_item_ui_infos_description_wh3_main_dae_cha_daemon_prince_weapon_exalted_keeper_of_secrets_shield_3		false
armory_item_ui_infos_description_wh3_main_dae_cha_daemon_prince_weapon_exalted_keeper_of_secrets_spear_1		false
armory_item_ui_infos_description_wh3_main_dae_cha_daemon_prince_weapon_exalted_lord_of_change_staff_1		false
armory_item_ui_infos_description_wh3_main_dae_cha_daemon_prince_weapon_exalted_lord_of_change_staff_2		false
armory_item_ui_infos_description_wh3_main_dae_cha_daemon_prince_weapon_great_unclean_one_sword_1		false
armory_item_ui_infos_description_wh3_main_dae_cha_daemon_prince_weapon_great_unclean_one_sword_2		false
armory_item_ui_infos_description_wh3_main_dae_cha_daemon_prince_weapon_great_unclean_one_sword_3		false
armory_item_ui_infos_description_wh3_main_dae_cha_daemon_prince_weapon_keeper_of_secrets_sword_1		false
armory_item_ui_infos_description_wh3_main_dae_cha_daemon_prince_weapon_keeper_of_secrets_sword_2		false
armory_item_ui_infos_description_wh3_main_dae_cha_daemon_prince_weapon_keeper_of_secrets_sword_3		false
armory_item_ui_infos_description_wh3_main_dae_cha_daemon_prince_weapon_pink_horror_dagger_1		false
armory_item_ui_infos_description_wh3_main_dae_cha_daemon_prince_weapon_pink_horror_dagger_2		false
armory_item_ui_infos_description_wh3_main_dae_cha_daemon_prince_weapon_pink_horror_dagger_3		false
armory_item_ui_infos_description_wh3_main_dae_cha_daemon_prince_weapon_skullcrusher_halberd_1		false
armory_item_ui_infos_description_wh3_main_dae_cha_daemon_prince_weapon_skullcrusher_halberd_2		false
armory_item_ui_infos_description_wh3_main_dae_cha_daemon_prince_weapon_skullcrusher_halberd_3		false
armory_item_ui_infos_description_wh3_main_dae_cha_daemon_prince_weapon_skullcrusher_shield_1		false
armory_item_ui_infos_description_wh3_main_dae_cha_daemon_prince_weapon_skullcrusher_shield_2		false
armory_item_ui_infos_description_wh3_main_dae_cha_daemon_prince_weapon_skullcrusher_shield_3		false
armory_item_ui_infos_description_wh3_main_dae_cha_daemon_prince_weapon_soulgrinder_sword_1		false
armory_item_ui_infos_description_wh3_main_dae_cha_daemon_prince_weapon_sword_1		false
armory_item_ui_infos_description_wh3_main_dae_cha_daemon_prince_wings_base_1	Though many Daemon Princes bear monstrous wings upon their backs, no such mutation has manifested here.	false
armory_item_ui_infos_description_wh3_main_dae_cha_daemon_prince_wings_base_2	A set of dark, leathery wings protrude from the back, unfolding between spines of bone into an expanse of rugged skin.	false
armory_item_ui_infos_description_wh3_main_dae_cha_daemon_prince_wings_base_3	The wings are hidden beneath reinforced armour, providing a durable layer of iron protection between sword and skin.	false
armory_item_ui_infos_description_wh3_main_dae_cha_daemon_prince_wings_base_4	Sharp, bloody fangs tip every joint of the wings, turning the appendages into deadly weapons in the service of Chaos.	false
armory_item_ui_infos_description_wh3_main_dae_cha_daemon_prince_wings_base_5	The wings are blackened and crisp, burned and mutated by the eternal embers of Chaos.	false
armory_item_ui_infos_description_wh3_main_dae_cha_daemon_prince_wings_base_6	The wounds of war scar these wings, where the taut skin has been torn and frayed in the tumult of battle.	false
armory_item_ui_infos_description_wh3_main_dae_cha_daemon_prince_wings_beast_1	Large and broad, these wings cast a great shadow as they take flight, blocking out the sun and leaving darkness in their wake.	false
armory_item_ui_infos_description_wh3_main_dae_cha_daemon_prince_wings_beast_2	Metal plates have been fixed to the wings, a curtain of brass over powerful muscle.	false
armory_item_ui_infos_description_wh3_main_dae_cha_daemon_prince_wings_beast_3	Heavy iron chains wrap the wings, where tied skulls sway threateningly – a message to all who would invoke the wrath of Khorne.	false
armory_item_ui_infos_description_wh3_main_dae_cha_daemon_prince_wings_beast_4	With long and twisting horns growing from the joints, the wings cut an imposing silhouette, even amidst the horrors of the Chaos Realms.	false
armory_item_ui_infos_description_wh3_main_dae_cha_daemon_prince_wings_beast_5	Fury and bloodlust fuel the fires of Khorne, which have scorched the wings black but for a few undying cinders that remain hauntingly aglow.	false
armory_item_ui_infos_description_wh3_main_dae_cha_daemon_prince_wings_beast_6	Carnage and slaughter have left their mark in the bloody tears and gauges of the wings.	false
