key	text	tooltip
armory_item_variant_ui_infos_description_wh3_main_dae_cha_daemon_prince_head_moon_03	Where once at the crest of the head formed a marvellous point, instead forms a cracked stump from which magic endlessly leaks.	false
armory_item_variant_ui_infos_description_wh3_main_dae_cha_daemon_prince_head_moon_04	Viciously long, sharp fangs project from the lower jaw to terrifying effect. 	false
armory_item_variant_ui_infos_description_wh3_main_dae_cha_daemon_prince_head_moon_05	Strange markings line the face in intricate patterns, glowing softly with mystical energy.	false
armory_item_variant_ui_infos_description_wh3_main_dae_cha_daemon_prince_head_moon_06	A finely-decorated metal faceplate armours the head, arching sharply over a single yellow eye.	false
armory_item_variant_ui_infos_description_wh3_main_dae_cha_daemon_prince_head_skull_01	The skin of the head has withered and decayed, peeling away to leave behind only a grotesque Daemonic skull.	false
armory_item_variant_ui_infos_description_wh3_main_dae_cha_daemon_prince_head_skull_02	Deep cracks run through the skull, spreading out in web-like formations from the weapon gouges of recent conflict.	false
armory_item_variant_ui_infos_description_wh3_main_dae_cha_daemon_prince_head_skull_03	From either side of the skull sprout tall, menacing horns of bone.	false
armory_item_variant_ui_infos_description_wh3_main_dae_cha_daemon_prince_head_skull_04	Skin still clings to the skull at the neck and chin, where a matted beard grows, braided with stomach-turning trophies of war. 	false
armory_item_variant_ui_infos_description_wh3_main_dae_cha_daemon_prince_head_skull_05	Moulded to the skull is an ornately carved headpiece, accentuating each curve and shadow of the bone. 	false
armory_item_variant_ui_infos_description_wh3_main_dae_cha_daemon_prince_head_skull_06	Unnatural fire roars from the skull, climbing the curve of each horn and creating two towering pillars of flame.	false
armory_item_variant_ui_infos_description_wh3_main_dae_cha_daemon_prince_head_unclean_01	The head is a grotesque mound of flesh, corpulent, discoloured and dripping with mortal disease.	false
armory_item_variant_ui_infos_description_wh3_main_dae_cha_daemon_prince_head_unclean_02	The horns that grow from between the rolls of swollen flesh have putrefied, causing them to splinter and break.	false
armory_item_variant_ui_infos_description_wh3_main_dae_cha_daemon_prince_head_unclean_03	The head drips with pestilence, festering in large, leaking buboes breaking out across the skin.	false
armory_item_variant_ui_infos_description_wh3_main_dae_cha_daemon_prince_head_unclean_04	The hideous, swollen head is crowned by a branching nest of horns.	false
armory_item_variant_ui_infos_description_wh3_main_dae_cha_daemon_prince_head_unclean_05	Skulls and dried heads clatter together at the back of the head, tied to a single horn and worn as grim trophies.	false
armory_item_variant_ui_infos_description_wh3_main_dae_cha_daemon_prince_head_unclean_06	The chin and jaw are both torn and malformed, displaced by the uncontrolled thrashing of a giant, blistered tongue.	false
armory_item_variant_ui_infos_description_wh3_main_dae_cha_daemon_prince_legs_base_01	Huge bands of muscle envelope the legs, and each stride thrums palpably with power.	false
armory_item_variant_ui_infos_description_wh3_main_dae_cha_daemon_prince_legs_base_02	Gruesome trophies are tied around the waist, callously plucked from the corpses of fallen victims.	false
armory_item_variant_ui_infos_description_wh3_main_dae_cha_daemon_prince_legs_base_03	The Daemonic fires of the Chaos Realms have scorched and charred the feet and lower legs, leaving the blackened skin solid and impenetrable.	false
armory_item_variant_ui_infos_description_wh3_main_dae_cha_daemon_prince_legs_base_04	From the coarse skin of the legs erupt deadly spurs, fit to draw blood on the slightest contact.	false
armory_item_variant_ui_infos_description_wh3_main_dae_cha_daemon_prince_legs_base_05	Heavy iron plate covers the entirety of the legs, serving as strong protection against any weapon.	false
armory_item_variant_ui_infos_description_wh3_main_dae_cha_daemon_prince_legs_base_06	The lower legs are protected by heavy iron greaves, while the thigh remains primarily uncovered.	false
armory_item_variant_ui_infos_description_wh3_main_dae_cha_daemon_prince_legs_beast_01	The thick, bestial legs are stunted and short, with thick patches of coarse fur growing above dark, cloven hooves.	false
armory_item_variant_ui_infos_description_wh3_main_dae_cha_daemon_prince_legs_beast_02	Between patches of fur, chains and rings of brass are visible, wrapped around the legs and pulsating with corrupting energy.	false
armory_item_variant_ui_infos_description_wh3_main_dae_cha_daemon_prince_legs_beast_03	From large, iron plates welded into the skin hang the bones and sorrows of the slain.	false
armory_item_variant_ui_infos_description_wh3_main_dae_cha_daemon_prince_legs_beast_04	Muscle bulges between each line of unyielding metal chain, pulled completely taut around the legs. 	false
armory_item_variant_ui_infos_description_wh3_main_dae_cha_daemon_prince_legs_beast_05	The legs are entirely armoured, with huge plates needed to protect the broad width of the thigh.	false
armory_item_variant_ui_infos_description_wh3_main_dae_cha_daemon_prince_legs_beast_06	While the thigh remains bare but for patchy tufts of fur, the lower legs are strapped with thick, metal armour.	false
armory_item_variant_ui_infos_description_wh3_main_dae_cha_daemon_prince_legs_beast_7	The thick, bestial legs are stunted and short, with thick patches of coarse fur growing above dark, cloven hooves.	false
armory_item_variant_ui_infos_description_wh3_main_dae_cha_daemon_prince_legs_beast_8	While the thigh remains bare but for patchy tufts of fur, the lower legs are strapped with thick, metal armour.	false
armory_item_variant_ui_infos_description_wh3_main_dae_cha_daemon_prince_legs_bird_01	Long feathers cover the thighs of these thin, avian legs, giving way to coarse skin towards the taloned feet. 	false
armory_item_variant_ui_infos_description_wh3_main_dae_cha_daemon_prince_legs_bird_02	Between the feathers of the thigh grow large and lethal spines.	false
armory_item_variant_ui_infos_description_wh3_main_dae_cha_daemon_prince_legs_bird_03	Gleaming ringlets and chains encircle the ankles, drawing the gaze of allies and enemies alike.	false
armory_item_variant_ui_infos_description_wh3_main_dae_cha_daemon_prince_legs_bird_04	The bony, avian legs are fully guarded by heavy mail and plate, eliminating most vulnerabilities.	false
armory_item_variant_ui_infos_description_wh3_main_dae_cha_daemon_prince_legs_bird_05	The heavy, iron greaves reach as far as the knee, where the fragile, thinness of the leg gives way to robust muscle.	false
armory_item_variant_ui_infos_description_wh3_main_dae_cha_daemon_prince_legs_bird_06	A loincloth is worn at the waist, emitting the strange and mysterious magic of Tzeentch.	false
armory_item_variant_ui_infos_description_wh3_main_dae_cha_daemon_prince_legs_bird_7	The heavy, iron greaves reach as far as the knee; jewels and carvings decorate the plates.	false
armory_item_variant_ui_infos_description_wh3_main_dae_cha_daemon_prince_legs_bird_8	Influenced by Tzeentch, these legs have been shaped and granted talons to give the appearance of the Lord of Change.	false
armory_item_variant_ui_infos_description_wh3_main_dae_cha_daemon_prince_legs_corpulent_01	The legs are fat and bulbous, and rife with Nurgle's foul decay. 	false
armory_item_variant_ui_infos_description_wh3_main_dae_cha_daemon_prince_legs_corpulent_02	Revolting pustules on the legs have burst open, revealing large spikes growing through the skin.	false
armory_item_variant_ui_infos_description_wh3_main_dae_cha_daemon_prince_legs_corpulent_03	These legs are ridden with pestilence, where large buboes form, seeping with abhorrent odour and pus.	false
armory_item_variant_ui_infos_description_wh3_main_dae_cha_daemon_prince_legs_corpulent_04	The potency of Nurgle's decay has affected even the leg armour, which has weakened and deteriorated with festering rot.	false
armory_item_variant_ui_infos_description_wh3_main_dae_cha_daemon_prince_legs_corpulent_05	Slick with the same revolting ooze that drips from the skin, these light greaves do naught to obscure the stink.	false
armory_item_variant_ui_infos_description_wh3_main_dae_cha_daemon_prince_legs_corpulent_06	The armour strains under the task of encompassing the whole leg, but provides adequate protection nonetheless.	false
armory_item_variant_ui_infos_description_wh3_main_dae_cha_daemon_prince_legs_corpulent_7	The armour strains under the task of encompassing the whole leg; thorned spikes cause much pain for any attackers.	false
armory_item_variant_ui_infos_description_wh3_main_dae_cha_daemon_prince_legs_daemonette_01	These pale, digitigrade legs are primarily unadorned, exposed entirely to the corrupting influence of Chaos.	false
armory_item_variant_ui_infos_description_wh3_main_dae_cha_daemon_prince_legs_daemonette_02	Metal straps and jewellery adorn the legs, offering some small measure of protection and decoration.	false
armory_item_variant_ui_infos_description_wh3_main_dae_cha_daemon_prince_legs_daemonette_03	Several horns and spikes sprout haphazardly from the skin, adorning the legs with a most deadly decoration.	false
armory_item_variant_ui_infos_description_wh3_main_dae_cha_daemon_prince_legs_daemonette_04	Skulls and withered appendages hang are clasped to a belt at the waist, glorious trophies of battle and domination.	false
armory_item_variant_ui_infos_description_wh3_main_dae_cha_daemon_prince_legs_daemonette_05	The legs remain mostly bare, but for the light greaves that ensure large expanses of skin remain displayed.	false
armory_item_variant_ui_infos_description_wh3_main_dae_cha_daemon_prince_legs_daemonette_06	When the need for protection outweighs any salacious intent, heavy greaves are worn up to the hock of the leg. 	false
armory_item_variant_ui_infos_description_wh3_main_dae_cha_daemon_prince_legs_daemonette_7	The legs remain mostly bare, but for the light greaves that ensure large expanses of skin remain displayed.	false
armory_item_variant_ui_infos_description_wh3_main_dae_cha_daemon_prince_legs_daemonette_8	When the need for protection outweighs any salacious intent, heavy greaves are worn up to the hock of the leg.	false
armory_item_variant_ui_infos_description_wh3_main_dae_cha_daemon_prince_tail_base_01	The spine leads into a Daemon tail, long and smooth to the touch.	false
armory_item_variant_ui_infos_description_wh3_main_dae_cha_daemon_prince_tail_base_02	The tail is tipped by a lethal brass spike, able to strike with the force of any spear.	false
armory_item_variant_ui_infos_description_wh3_main_dae_cha_daemon_prince_tail_base_03	Where the illuminating glow of the flame ends, the blackened, calcified flesh of the tail begins.	false
armory_item_variant_ui_infos_description_wh3_main_dae_cha_daemon_prince_tail_base_04	Along the length of the tail grow brutal spines; fragments of bone so sharp they have forced their way through the skin.	false
armory_item_variant_ui_infos_description_wh3_main_dae_cha_daemon_prince_tail_base_05	Like a living mace, lengthy spikes grow from the end of the tail that are capable of bludgeoning enemies and smashing their skulls into splinters.	false
armory_item_variant_ui_infos_description_wh3_main_dae_cha_daemon_prince_tail_base_06	The tail is armoured, adding both protection and weight to its blunt and heavy strike. 	false
armory_item_variant_ui_infos_description_wh3_main_dae_cha_daemon_prince_tail_beast_01	The tail is short and thick, with a thick plume of hair rustling coarsely at the tip.	false
armory_item_variant_ui_infos_description_wh3_main_dae_cha_daemon_prince_tail_beast_02	Iron armour lines the tail, ugly yet undeniably sturdy.	false
armory_item_variant_ui_infos_description_wh3_main_dae_cha_daemon_prince_tail_beast_03	The lower spine flows into the thick and pointed tail of a Flesh Hound.	false
armory_item_variant_ui_infos_description_wh3_main_dae_cha_daemon_prince_tail_beast_04	The tail is wrapped with chains, weighed down with cumbersome metal.	false
armory_item_variant_ui_infos_description_wh3_main_dae_cha_daemon_prince_tail_beast_05	The end of the tail has mutated and changed, forming a dense mound of solid, club-like flesh.	false
armory_item_variant_ui_infos_description_wh3_main_dae_cha_daemon_prince_tail_beast_06	The blackened flesh and charred skin of the tail is damaged beyond healing, burnt in the flaming carnage of war.	false
armory_item_variant_ui_infos_description_wh3_main_dae_cha_daemon_prince_tail_corpulent_01	A fat, slug-like tail oozing with the rotten miasma of death and decay.	false
armory_item_variant_ui_infos_description_wh3_main_dae_cha_daemon_prince_tail_corpulent_02	Eroded by its own rot, the armour shielding the tail is broken, decrepit and feeble.	false
armory_item_variant_ui_infos_description_wh3_main_dae_cha_daemon_prince_tail_corpulent_03	Atop the slimy secretions of the tail is attached a layer of heavy armour for shelter.	false
armory_item_variant_ui_infos_description_wh3_main_dae_cha_daemon_prince_tail_corpulent_04	Spikes rise above the layer of grime that coats the skin of the tail, their cut sure to leave behind sickness and malady.	false
armory_item_variant_ui_infos_description_wh3_main_dae_cha_daemon_prince_tail_corpulent_05	Swollen pustules and buboes coat the tail, leaking the abhorrent and insidious corruption of Nurgle.	false
armory_item_variant_ui_infos_description_wh3_main_dae_cha_daemon_prince_tail_corpulent_06	Each swollen and infected joint of the tail is wrapped with chains, where the broken skulls of past victims are tied, eternally dragging behind. 	false
armory_item_variant_ui_infos_description_wh3_main_dae_cha_daemon_prince_tail_fiend_01	The tail is smooth and strong, and always poised as if ready to sting. 	false
armory_item_variant_ui_infos_description_wh3_main_dae_cha_daemon_prince_tail_fiend_02	Decorative ringlets loop along the tail, promoting an air of fiendish finesse and allure.	false
armory_item_variant_ui_infos_description_wh3_main_dae_cha_daemon_prince_tail_fiend_03	The scorpion-like appearance of the tail is only somewhat obscured by the plate armour attached along its length.	false
armory_item_variant_ui_infos_description_wh3_main_dae_cha_daemon_prince_tail_fiend_04	The tail is shielded by an imposing armour of metal spikes, guarding it from the enemies of Chaos.	false
armory_item_variant_ui_infos_description_wh3_main_dae_cha_daemon_prince_tail_fiend_05	Hooks and chains entwine around the tail, rusted and bloody from all manner of cruel delights.	false
armory_item_variant_ui_infos_description_wh3_main_dae_cha_daemon_prince_tail_fiend_06	A scythe-like blade has mutated at the end of the tail, able to skewer enemies in one savage thrust.	false
armory_item_variant_ui_infos_description_wh3_main_dae_cha_daemon_prince_tail_flamer_01	An air of mystical sentience surrounds the tail, thrashing and snapping at will.	false
armory_item_variant_ui_infos_description_wh3_main_dae_cha_daemon_prince_tail_flamer_02	Heavily plated with metal, the tail writhes uncontrollably wreaking havoc with its weight.	false
armory_item_variant_ui_infos_description_wh3_main_dae_cha_daemon_prince_tail_flamer_03	The tail is decorated in ringlets and jewellery, though whether to the tastes of its owner or the tail itself remains unknown.	false
armory_item_variant_ui_infos_description_wh3_main_dae_cha_daemon_prince_tail_flamer_04	Small, edged teeth grow across the tail, delivering a thousand cuts with a single swipe.	false
armory_item_variant_ui_infos_description_wh3_main_dae_cha_daemon_prince_tail_flamer_05	Ferocious, snapping teeth fill the numerous mouths that line the tail, each one seeking to sate its own endless hunger.	false
armory_item_variant_ui_infos_description_wh3_main_dae_cha_daemon_prince_tail_flamer_06	Magical Daemonic energy thrums along the tail, as iridescent and captivating as it is corrupting.	false
armory_item_variant_ui_infos_description_wh3_main_dae_cha_daemon_prince_tail_living_01	A hungry, malevolent mouth thrashes at the end of the tail, twisting and turning in search of easy prey.	false
armory_item_variant_ui_infos_description_wh3_main_dae_cha_daemon_prince_tail_living_02	Plated in heavy armour, the tail is increasingly reckless in hungrily seeking its victims.	false
armory_item_variant_ui_infos_description_wh3_main_dae_cha_daemon_prince_tail_living_03	The suffocating bind of chains has done little to quell the vicious nature of the tail.	false
armory_item_variant_ui_infos_description_wh3_main_dae_cha_daemon_prince_tail_living_04	The destructive spines on this sentient tail make its hunger for mayhem all the easier to sate.	false
armory_item_variant_ui_infos_description_wh3_main_dae_cha_daemon_prince_tail_living_05	Arrow heads and gouging scars devastate the tail, yet its relentless spite and hostility remain undiminished.	false
armory_item_variant_ui_infos_description_wh3_main_dae_cha_daemon_prince_tail_living_06	The malevolent, bloodthirsty energy of Khorne permeates the tail, radiating from it in Chaotic waves of pure hate.	false
armory_item_variant_ui_infos_description_wh3_main_dae_cha_daemon_prince_tail_rotfly_01	A cavernous mouth has formed on the tail, hungry to feed and devour.	false
armory_item_variant_ui_infos_description_wh3_main_dae_cha_daemon_prince_tail_rotfly_02	Vicious spikes run up the tail and around the mouth, making the appendage a formidable weapon.	false
armory_item_variant_ui_infos_description_wh3_main_dae_cha_daemon_prince_tail_rotfly_03	Disease-ridden buboes, filled with grime and pus, infest the entire tail.	false
armory_item_variant_ui_infos_description_wh3_main_dae_cha_daemon_prince_tail_rotfly_04	A single, poisonous spike erupts from the end of the tail, delivering a deadly sting. 	false
armory_item_variant_ui_infos_description_wh3_main_dae_cha_daemon_prince_tail_rotfly_05	The tail  culminates in a bulbous mound of noxious, plagued flesh.	false
armory_item_variant_ui_infos_description_wh3_main_dae_cha_daemon_prince_tail_rotfly_06	An slick an bloodshot eyeball sits at the end of the tail, its gaze pointed and unwavering.	false
armory_item_variant_ui_infos_description_wh3_main_dae_cha_daemon_prince_tail_screamer_01	A long and flowing tail trails from the base of the spine.	false
armory_item_variant_ui_infos_description_wh3_main_dae_cha_daemon_prince_tail_screamer_02	The flow of the tail is decorated with metal rings and light chains.	false
armory_item_variant_ui_infos_description_wh3_main_dae_cha_daemon_prince_tail_screamer_03	Deadly spikes grow from the tail, clustering at the bottom.	false
armory_item_variant_ui_infos_description_wh3_main_dae_cha_daemon_prince_tail_screamer_04	The flowing tail watches its foes through a mass of vigilant eyes.	false
armory_item_variant_ui_infos_description_wh3_main_dae_cha_daemon_prince_tail_screamer_05	Sharp spines project from the tail, giving pause to any foolish enough to approach from behind.	false
armory_item_variant_ui_infos_description_wh3_main_dae_cha_daemon_prince_tail_screamer_06	Hideous teeth of varying sizes run along the length of the tail.	false
armory_item_variant_ui_infos_description_wh3_main_dae_cha_daemon_prince_tail_steed_01	The tail is long and finned, like that of the perversely alluring Steed of Slaanesh.	false
armory_item_variant_ui_infos_description_wh3_main_dae_cha_daemon_prince_tail_steed_02	The finned tail is adorned with delicate ringlets, only serving to enhance its odd beauty.	false
armory_item_variant_ui_infos_description_wh3_main_dae_cha_daemon_prince_tail_steed_03	Plate metal armours the tail, creating a strong protective shell.	false
armory_item_variant_ui_infos_description_wh3_main_dae_cha_daemon_prince_tail_steed_04	Menacing spikes grow from the tail, running from base to tip.	false
armory_item_variant_ui_infos_description_wh3_main_dae_cha_daemon_prince_tail_steed_05	Mutation has transformed the tail, which rather than a fin now culminates in a cluster of lethal spines.	false
armory_item_variant_ui_infos_description_wh3_main_dae_cha_daemon_prince_tail_steed_06	Horned tips grow from the tail, the terrifying result of corruption and mutation.	false
armory_item_variant_ui_infos_description_wh3_main_dae_cha_daemon_prince_torso_adornedarmour_01	A lithe and graceful body of indeterminate gender, as powerful and abhorrent as it is strangely alluring.	false
armory_item_variant_ui_infos_description_wh3_main_dae_cha_daemon_prince_torso_adornedarmour_02	Bloody carvings decorate the rent flesh of the body, twisting in chaotic patterns that honour the Dark Prince Slaanesh.	false
armory_item_variant_ui_infos_description_wh3_main_dae_cha_daemon_prince_torso_adornedarmour_03	Both gleaming jewels and grisly trophies decorate the body, a testament of strength and prestige in the Realms of Chaos.	false
armory_item_variant_ui_infos_description_wh3_main_dae_cha_daemon_prince_torso_adornedarmour_04	Pristine armour of heavy plate is sculpted to the body and shoulders, hugging every shape and curve.	false
armory_item_variant_ui_infos_description_wh3_main_dae_cha_daemon_prince_torso_adornedarmour_05	Heavy armour that moulds to the body, leaving the shoulders bare.	false
armory_item_variant_ui_infos_description_wh3_main_dae_cha_daemon_prince_torso_adornedarmour_06	The armour is thin and light, protecting little and covering up even less.	false
armory_item_variant_ui_infos_description_wh3_main_dae_cha_daemon_prince_torso_armoured_01	The chestplate has been cracked and  broken, leaving a vast chasm at its centre.	false
armory_item_variant_ui_infos_description_wh3_main_dae_cha_daemon_prince_torso_armoured_02	Leather chest straps fasten to simple pauldrons, both bearing the clear influence of Khorne.	false
armory_item_variant_ui_infos_description_wh3_main_dae_cha_daemon_prince_torso_armoured_03	The sturdy chestplate is stained red with the blood of slain foes.	false
armory_item_variant_ui_infos_description_wh3_main_dae_cha_daemon_prince_torso_armoured_04	Heavy and protective, the red plate armour and pauldrons are an immense shell of Khornate might.	false
armory_item_variant_ui_infos_description_wh3_main_dae_cha_daemon_prince_torso_armoured_05	Large spikes jut from the chestplate, as bloody a red as the metal plate of the armour itself.	false
armory_item_variant_ui_infos_description_wh3_main_dae_cha_daemon_prince_torso_armoured_06	Metal plaques decorate the leather armour, where trophies of war hang as a foreboding message to foes.	false
armory_item_variant_ui_infos_description_wh3_main_dae_cha_daemon_prince_torso_base_01	The body is a wall of pure muscle, with the Mark of Chaos worn proudly on the chest.  	false
armory_item_variant_ui_infos_description_wh3_main_dae_cha_daemon_prince_torso_base_02	As large and brutish as the Blood God himself, this body bears the searing Mark of Khorne. 	false
armory_item_variant_ui_infos_description_wh3_main_dae_cha_daemon_prince_torso_base_03	With the Mark of Nurgle displayed clearly on the chest, this body is a conduit of death and decay.	false
armory_item_variant_ui_infos_description_wh3_main_dae_cha_daemon_prince_torso_base_04	The perfectly-formed Mark of Slaanesh adorns the smooth, desirable skin of the chest.	false
armory_item_variant_ui_infos_description_wh3_main_dae_cha_daemon_prince_torso_base_05	Imbued with terrible, arcane knowledge, the Mark of Tzeentch is borne as a stamp of pride on the body.	false
armory_item_variant_ui_infos_description_wh3_main_dae_cha_daemon_prince_torso_base_06	Forming a cross on the chest, the dual leather straps make a taunting target for the enemies of Chaos.	false
armory_item_variant_ui_infos_description_wh3_main_dae_cha_daemon_prince_torso_base_07	Small horns and spikes erupt from the skin, leaving a spiny trail across the body.	false
armory_item_variant_ui_infos_description_wh3_main_dae_cha_daemon_prince_torso_base_08	The body is shielded by an armour of thick, heavy plate.	false
armory_item_variant_ui_infos_description_wh3_main_dae_cha_daemon_prince_torso_base_09	Heavy armour protects the chest, while the lack of pauldrons reduces any limitation on mobility.	false
armory_item_variant_ui_infos_description_wh3_main_dae_cha_daemon_prince_torso_base_10	Simple straps of leather armour protect the body, with thick pauldrons attached at the shoulders.	false
armory_item_variant_ui_infos_description_wh3_main_dae_cha_daemon_prince_torso_bird_01	The body has morphed and mutated into a bird-like physique, with light tufts of feathers sprouting from the skin.	false
armory_item_variant_ui_infos_description_wh3_main_dae_cha_daemon_prince_torso_bird_02	The weight of heavy jewellery is nothing to one who carries the weight of Tzeentch's dark knowledge.	false
armory_item_variant_ui_infos_description_wh3_main_dae_cha_daemon_prince_torso_bird_03	Leather straps hold down the feathers growing along the torso in patches, providing a small amount of protection.	false
armory_item_variant_ui_infos_description_wh3_main_dae_cha_daemon_prince_torso_bird_04	A heavy chest piece protects the slim avian physique.	false
armory_item_variant_ui_infos_description_wh3_main_dae_cha_daemon_prince_torso_bird_05	Heavy plate chest armour and pauldrons provide maximum protection against all manner of weapons.	false
armory_item_variant_ui_infos_description_wh3_main_dae_cha_daemon_prince_torso_bird_06	The deep runes carved into the body swirl and glow with magical energy. 	false
armory_item_variant_ui_infos_description_wh3_main_dae_cha_daemon_prince_torso_brasscollar_01	Corruption leeches from the sharp metal spikes of the collar, leaving its dark infection glowing in its wearers veins. 	false
