key	text	tooltip
#Loc;1;text/db/armory_item_variant_ui_infos__.loc		
armory_item_variant_ui_infos_description_wh3_main_dae_cha_daemon_prince_arm_armoured_01	Broken gauntlets still adorn the arms, their damaged remains no more than an illustration of resilience.	false
armory_item_variant_ui_infos_description_wh3_main_dae_cha_daemon_prince_arm_armoured_02	Light gauntlets of leather and scale, soaked in the blood of their wearer's enemies.	false
armory_item_variant_ui_infos_description_wh3_main_dae_cha_daemon_prince_arm_armoured_03	Moderately heavy gauntlets, for treading the line between mobility and power.	false
armory_item_variant_ui_infos_description_wh3_main_dae_cha_daemon_prince_arm_armoured_04	Plate gauntlets of brass and iron, an impenetrable wall between their wearer and their soon-to-be victims.	false
armory_item_variant_ui_infos_description_wh3_main_dae_cha_daemon_prince_arm_armoured_05	Sharp metal spikes adorn the menacing Khornate gauntlets, adding brutal lethality to every unarmed strike.	false
armory_item_variant_ui_infos_description_wh3_main_dae_cha_daemon_prince_arm_armoured_06	Khorne's fiery temper blisters and burns across the surface of the gauntlets, ignited by the hellish fires of Chaos.	false
armory_item_variant_ui_infos_description_wh3_main_dae_cha_daemon_prince_arm_base_01	Large and powerful, the arms are thick with muscle and imbued with unnatural strength.	false
armory_item_variant_ui_infos_description_wh3_main_dae_cha_daemon_prince_arm_base_02	The arms are blackened and burnt, charred completely but for the glowing embers that remain, still burning bright at the fingertips. 	false
armory_item_variant_ui_infos_description_wh3_main_dae_cha_daemon_prince_arm_base_03	The twisted energies of Chaos flow through the arms, glowing a deep and violent red.	false
armory_item_variant_ui_infos_description_wh3_main_dae_cha_daemon_prince_arm_base_04	A sturdy metal gauntlet is worn on the arms, granting immeasurable power in a single fist. 	false
armory_item_variant_ui_infos_description_wh3_main_dae_cha_daemon_prince_arm_base_05	A light gauntlet protects the arm, ensuring no errant slashes will cause any harm.	false
armory_item_variant_ui_infos_description_wh3_main_dae_cha_daemon_prince_arm_base_06	Razor-sharp spikes protrude from the arms, capable of tearing through meat and bone.	false
armory_item_variant_ui_infos_description_wh3_main_dae_cha_daemon_prince_arm_beast_01	The arm is short yet exceedingly muscular, with coarse fur growing in patches across the skin.	false
armory_item_variant_ui_infos_description_wh3_main_dae_cha_daemon_prince_arm_beast_02	The muscles of the arm bulge and strain between lengths of tightly-wound chain.	false
armory_item_variant_ui_infos_description_wh3_main_dae_cha_daemon_prince_arm_beast_03	Thick leather straps bind each arm, a measure of protection against light slashes and blows.	false
armory_item_variant_ui_infos_description_wh3_main_dae_cha_daemon_prince_arm_beast_04	Bracers of brass are worn on the wrists, where metal spikes stand high above the thick cover of fur. 	false
armory_item_variant_ui_infos_description_wh3_main_dae_cha_daemon_prince_arm_beast_05	Bones and bloody appendages hang from metal plates, welded into the arms themselves.	false
armory_item_variant_ui_infos_description_wh3_main_dae_cha_daemon_prince_arm_beast_06	The hands are alight with ferocious flame, a searing fire burning across the skin.	false
armory_item_variant_ui_infos_description_wh3_main_dae_cha_daemon_prince_arm_bird_01	Thin, bird-like wrists support the hands, where razor-sharp talons grow, clutching an ever watchful eye, its gaze flitting over all.	false
armory_item_variant_ui_infos_description_wh3_main_dae_cha_daemon_prince_arm_bird_02	The arms are wrapped in thick metal bands, where skin and feather bulge between each chain.	false
armory_item_variant_ui_infos_description_wh3_main_dae_cha_daemon_prince_arm_bird_03	Intricately decorated bracers cover the arm, offering little in the way of sturdiness.	false
armory_item_variant_ui_infos_description_wh3_main_dae_cha_daemon_prince_arm_bird_04	The whole arm is protected by a heavy bracer of multiple parts, leaving very little skin uncovered.	false
armory_item_variant_ui_infos_description_wh3_main_dae_cha_daemon_prince_arm_bird_05	The arms are lined with thick barbs running along their length, each capable of dealing a fatal injury. 	false
armory_item_variant_ui_infos_description_wh3_main_dae_cha_daemon_prince_arm_bird_06	Decorative ringlets circle the arms, glinting in the sunlight.	false
armory_item_variant_ui_infos_description_wh3_main_dae_cha_daemon_prince_arm_corpulent_01	The arms are swollen to an enormous size, the flesh putrefying on the bone.	false
armory_item_variant_ui_infos_description_wh3_main_dae_cha_daemon_prince_arm_corpulent_02	Diseased spikes stand out from the arm, adding devastating cutting power to their immense weight.	false
armory_item_variant_ui_infos_description_wh3_main_dae_cha_daemon_prince_arm_corpulent_03	The overwhelming fat of the arm has burst the  gauntlet above, cracking the armour and leaving the flesh exposed.	false
armory_item_variant_ui_infos_description_wh3_main_dae_cha_daemon_prince_arm_corpulent_04	The light gauntlet strains to hold together over the ever fattening arm it is intended to protect.	false
armory_item_variant_ui_infos_description_wh3_main_dae_cha_daemon_prince_arm_corpulent_05	A vast expanse of metal as been hammered together into an ugly gauntlet, protecting the soft, fatty tissue underneath.	false
armory_item_variant_ui_infos_description_wh3_main_dae_cha_daemon_prince_arm_corpulent_06	Shoulder to fingertip, the diseased, corpulent arm is protected by thick, heavy plate.	false
armory_item_variant_ui_infos_description_wh3_main_dae_cha_daemon_prince_arm_flamer_01	Each arm culminates in a viciously snapping mouth, grinning with pointed teeth and regularly spitting wyrdflame.	false
armory_item_variant_ui_infos_description_wh3_main_dae_cha_daemon_prince_arm_flamer_02	The arms are decorated with jewelled bands and the finest of chains.	false
armory_item_variant_ui_infos_description_wh3_main_dae_cha_daemon_prince_arm_flamer_03	While the vicious, snapping mouth remains uncovered, the rest of the arm is protected by a decorative bracer.	false
armory_item_variant_ui_infos_description_wh3_main_dae_cha_daemon_prince_arm_flamer_04	Heavily protected, the arm is entirely sheltered by heavy plate but for the hungry mouth at its end.	false
armory_item_variant_ui_infos_description_wh3_main_dae_cha_daemon_prince_arm_flamer_05	The large spikes growing from the arm are almost as sharp as the needle-like teeth they lead to.	false
armory_item_variant_ui_infos_description_wh3_main_dae_cha_daemon_prince_arm_flamer_06	Rings of metal encircle the arms, doing naught to draw attention away from the vicious snapping jaws at their end.	false
armory_item_variant_ui_infos_description_wh3_main_dae_cha_daemon_prince_arm_moutharm_01	The hand has mutated into a cavernous mouth, where rows upon rows of fang-like teeth grow.	false
armory_item_variant_ui_infos_description_wh3_main_dae_cha_daemon_prince_arm_moutharm_02	The mouth at the end of the arm gapes to reveal a large and heavy tongue, where spikes grow unchecked at the tip.	false
armory_item_variant_ui_infos_description_wh3_main_dae_cha_daemon_prince_arm_moutharm_03	When the mouth opens and the tongue protrudes, the sharp and deadly claw of a Rot Fly shoots forth at the tip.	false
armory_item_variant_ui_infos_description_wh3_main_dae_cha_daemon_prince_arm_moutharm_04	An eyeball watches from inside the mouth, fixing its gaze on likely prey.	false
armory_item_variant_ui_infos_description_wh3_main_dae_cha_daemon_prince_arm_moutharm_05	From the mouth on the arm writhes a grotesque tentacle, its long reach and dexterity a threat to all foes.	false
armory_item_variant_ui_infos_description_wh3_main_dae_cha_daemon_prince_arm_moutharm_06	A tongue snaps out of the mouth with ferocious speed, the claw at its end snatching at all it can find.	false
armory_item_variant_ui_infos_description_wh3_main_dae_cha_daemon_prince_arm_mutated_01	The arm has mutated into a hulking and brutal blunt weapon, flesh moulding unnaturally around a heavy club.	false
armory_item_variant_ui_infos_description_wh3_main_dae_cha_daemon_prince_arm_mutated_02	Where once swords hilts lay, now is a mound of flesh where the arm has grown, holding their blades in a permanent grip.	false
armory_item_variant_ui_infos_description_wh3_main_dae_cha_daemon_prince_arm_mutated_03	The skulls of slaughtered enemies have melded into the arm, its flesh mutating to swallow them whole.	false
armory_item_variant_ui_infos_description_wh3_main_dae_cha_daemon_prince_arm_mutated_04	A huge hammer stems from the arm in place of a hand, a horrifying amalgamation of meat and metal.	false
armory_item_variant_ui_infos_description_wh3_main_dae_cha_daemon_prince_arm_mutated_05	The head of an axe lies at the end of the arm, hideously mutated into permanent tool of destruction.	false
armory_item_variant_ui_infos_description_wh3_main_dae_cha_daemon_prince_arm_mutated_06	The flesh of the arm twists and bends around a collection of horns, the jagged points protruding in every direction.	false
armory_item_variant_ui_infos_description_wh3_main_dae_cha_daemon_prince_arm_pincer_01	The smooth skin of the arms gives way to solid, mutated flesh, forming devastating pincers where the hand once was.	false
armory_item_variant_ui_infos_description_wh3_main_dae_cha_daemon_prince_arm_pincer_02	The keen metal edge of the pincers are serrated, capable of spilling blood with ease.	false
armory_item_variant_ui_infos_description_wh3_main_dae_cha_daemon_prince_arm_pincer_03	Sharp teeth run along the edge of the pincers' blade, biting and tearing into the flesh of all they strike.	false
armory_item_variant_ui_infos_description_wh3_main_dae_cha_daemon_prince_arm_pincer_04	Large spikes jut out from the top of the pincers, making either side of the appendage equally lethal.	false
armory_item_variant_ui_infos_description_wh3_main_dae_cha_daemon_prince_arm_pincer_05	The pincers are protected by delicately decorated armour, attached along their length.	false
armory_item_variant_ui_infos_description_wh3_main_dae_cha_daemon_prince_arm_pincer_06	A powerful Daemonic aura emanates from the pincers, spreading the dark corruption of Chaos.	false
armory_item_variant_ui_infos_description_wh3_main_dae_cha_daemon_prince_arm_scythe_01	The flesh of the arm is wholly mutated. Where once the lower arms and hands belonged, wicked, deadly scythes grow instead.	false
armory_item_variant_ui_infos_description_wh3_main_dae_cha_daemon_prince_arm_scythe_02	The sharp, bladed edge of the scythes are serrated to better carve through swathes of enemies.	false
armory_item_variant_ui_infos_description_wh3_main_dae_cha_daemon_prince_arm_scythe_03	Teeth-like fangs run along the inner edge of the blade, that a foe might feel their bite with every swing.	false
armory_item_variant_ui_infos_description_wh3_main_dae_cha_daemon_prince_arm_scythe_04	Where the inside edge of each scythe is a lethally keen blade, the other is spiked, capable of brutal blunt force.	false
armory_item_variant_ui_infos_description_wh3_main_dae_cha_daemon_prince_arm_scythe_05	Each scythe is reinforced by ornately-decorated armour, capturing a most deadly beauty.	false
armory_item_variant_ui_infos_description_wh3_main_dae_cha_daemon_prince_arm_scythe_06	A wicked and foul Daemonic energy pulsates from the scythes, corrupting the very air through which they cut.	false
armory_item_variant_ui_infos_description_wh3_main_dae_cha_daemon_prince_head_2headed_01	A twisted nightmare of Daemonic flesh, two heads move as one, fused together by bone and skin.	false
armory_item_variant_ui_infos_description_wh3_main_dae_cha_daemon_prince_head_2headed_02	From the fused head grow large, monstrous horns, a symbol of power and malevolent intent.	false
armory_item_variant_ui_infos_description_wh3_main_dae_cha_daemon_prince_head_2headed_03	Horrific, lengthy spikes protrude from the face and eye sockets.	false
armory_item_variant_ui_infos_description_wh3_main_dae_cha_daemon_prince_head_2headed_04	Much like the head they grow from, these horns have twisted and malformed, merging into one.	false
armory_item_variant_ui_infos_description_wh3_main_dae_cha_daemon_prince_head_2headed_05	In order to armour the misshapen skull, an ugly helm has been hammered together from mismatching plates of iron.	false
armory_item_variant_ui_infos_description_wh3_main_dae_cha_daemon_prince_head_2headed_06	An array of broken arrows and shattered blades remain lodged in the skull, mere tokens of glorious battle.	false
armory_item_variant_ui_infos_description_wh3_main_dae_cha_daemon_prince_head_adornedhelmet_01	The protective helm is lightly decorated with a short feather plume adorning the rear.	false
armory_item_variant_ui_infos_description_wh3_main_dae_cha_daemon_prince_head_adornedhelmet_02	A helm of exquisite detail, with horns, large and ornate, stemming from either side.	false
armory_item_variant_ui_infos_description_wh3_main_dae_cha_daemon_prince_head_adornedhelmet_03	A long tassel of tied hair hangs from the back of the helm, swaying hypnotically with every movement.	false
armory_item_variant_ui_infos_description_wh3_main_dae_cha_daemon_prince_head_adornedhelmet_04	Plumed decoratively down the centre, the helm is as much a work of art as it is a piece of armour.	false
armory_item_variant_ui_infos_description_wh3_main_dae_cha_daemon_prince_head_adornedhelmet_05	Long feathers decorate the helm, creating an air of cruel beauty worthy of the Prince of Pleasure.	false
armory_item_variant_ui_infos_description_wh3_main_dae_cha_daemon_prince_head_adornedhelmet_06	Through the narrow slit of the occularium, the wicked glint of the eyes is all that is visible of the face in this beautifully adorned helm.	false
armory_item_variant_ui_infos_description_wh3_main_dae_cha_daemon_prince_head_adornedhelmet_7	The protective helm is lightly decorated with no need for excessive plumage or trinkets.	false
armory_item_variant_ui_infos_description_wh3_main_dae_cha_daemon_prince_head_adornedhelmet_8	The face is partially hidden under the decorative mask, which leaves much to be desired.	false
armory_item_variant_ui_infos_description_wh3_main_dae_cha_daemon_prince_head_base_01	Short horns erupt through broken skin, arching into a terrible, Daemonic crown.	false
armory_item_variant_ui_infos_description_wh3_main_dae_cha_daemon_prince_head_base_02	One horn stands splintered and broken, snapped in the midst of the violent carnage of battle.	false
armory_item_variant_ui_infos_description_wh3_main_dae_cha_daemon_prince_head_base_03	As monstrously sharp as the tip of a blade, the horns stretch towards a sky darkened by Chaos.	false
armory_item_variant_ui_infos_description_wh3_main_dae_cha_daemon_prince_head_base_04	The horns sit low, tilted as if readied to impale victims with a devastating charge.	false
armory_item_variant_ui_infos_description_wh3_main_dae_cha_daemon_prince_head_base_05	Fortified with brass, these low, spear-like horns point ahead with deadly intent. 	false
armory_item_variant_ui_infos_description_wh3_main_dae_cha_daemon_prince_head_base_06	Charred black with ash, these razor-tipped horns blaze bright with eternal flame. 	false
armory_item_variant_ui_infos_description_wh3_main_dae_cha_daemon_prince_head_base_10	Large vine-like horns twist and turn around each other, bending into one another until the bony structures intertwine.	false
armory_item_variant_ui_infos_description_wh3_main_dae_cha_daemon_prince_head_base_11	The large, misshapen horns are decorated with bells to warn enemies of the imminent danger.	false
armory_item_variant_ui_infos_description_wh3_main_dae_cha_daemon_prince_head_base_7	Plagued horns have broken through the skin to become the main feature.	false
armory_item_variant_ui_infos_description_wh3_main_dae_cha_daemon_prince_head_base_8	These frail horns have bent, broken and snapped in the heat of battle.	false
armory_item_variant_ui_infos_description_wh3_main_dae_cha_daemon_prince_head_base_9	Nurgle's influence has caused multiple spikes to erupt from the skull, infesting the whole head.	false
armory_item_variant_ui_infos_description_wh3_main_dae_cha_daemon_prince_head_beast_01	A horned and hideous countenance from which sharp fangs and an animalistic snout protrude. 	false
armory_item_variant_ui_infos_description_wh3_main_dae_cha_daemon_prince_head_beast_02	Forward-pointed horns and a ringed snout manifest as the physical embodiments of Khorne's malignant fury.  	false
armory_item_variant_ui_infos_description_wh3_main_dae_cha_daemon_prince_head_beast_03	The head – beastly and contorted – is adorned with the shattered horns of one well-versed in brutality and bloodshed.	false
armory_item_variant_ui_infos_description_wh3_main_dae_cha_daemon_prince_head_beast_04	Bloody trophies of the slain hang from the beard and horns, serving as a grim warning to all.	false
armory_item_variant_ui_infos_description_wh3_main_dae_cha_daemon_prince_head_beast_05	Any horrors of the face lie hidden behind this sturdy and elaborate helm.	false
armory_item_variant_ui_infos_description_wh3_main_dae_cha_daemon_prince_head_beast_06	The accursed fire of Khorne's murderous rage sets ablaze the whole length of the horns.	false
armory_item_variant_ui_infos_description_wh3_main_dae_cha_daemon_prince_head_bird_01	Mutated in Tzeentch's image, the head is beaked and lightly feathered to better mirror the mysteries of the Lord of Change.	false
armory_item_variant_ui_infos_description_wh3_main_dae_cha_daemon_prince_head_bird_02	The feathers clump together on the head, growing in ugly tufts.	false
armory_item_variant_ui_infos_description_wh3_main_dae_cha_daemon_prince_head_bird_03	The beak sharpens to a long and lethal point. 	false
armory_item_variant_ui_infos_description_wh3_main_dae_cha_daemon_prince_head_bird_04	Broken and bent beyond repair, only the remnants of a once proud beak remain.	false
armory_item_variant_ui_infos_description_wh3_main_dae_cha_daemon_prince_head_bird_05	Plated in finely adorned armour, the beak is well protected, and decorated with a remarkable pendant, hanging always in flux.	false
armory_item_variant_ui_infos_description_wh3_main_dae_cha_daemon_prince_head_bird_06	Concealed by a terrible, horned mask, its wearer remains shrouded in mystery. 	false
armory_item_variant_ui_infos_description_wh3_main_dae_cha_daemon_prince_head_bird_7	Alluding to Tzeentch's image, a beak protrudes to mirror that of the Lord of Change.	false
armory_item_variant_ui_infos_description_wh3_main_dae_cha_daemon_prince_head_bird_8	Plucked, broken and bent out of shape, only the remnants of a once-proud beak remain.	false
armory_item_variant_ui_infos_description_wh3_main_dae_cha_daemon_prince_head_corpulent_01	The head is pallid and bloated with disease, bearing a single eye at its centre and a plague-ridden horn at its crest.	false
armory_item_variant_ui_infos_description_wh3_main_dae_cha_daemon_prince_head_corpulent_02	Weakened by decay and decomposition, the horns have snapped under the force of a mighty blow.	false
armory_item_variant_ui_infos_description_wh3_main_dae_cha_daemon_prince_head_corpulent_03	Devastating spikes erupt from the fleshy features of the face, infesting the whole head.	false
armory_item_variant_ui_infos_description_wh3_main_dae_cha_daemon_prince_head_corpulent_04	Large, twisting horns grow from the rotund head, bending into each other until the bony structures intertwine. 	false
armory_item_variant_ui_infos_description_wh3_main_dae_cha_daemon_prince_head_corpulent_05	The large, misshapen horns are decorated with bells to warn enemies of the imminent danger.	false
armory_item_variant_ui_infos_description_wh3_main_dae_cha_daemon_prince_head_corpulent_06	Hideous, growth-like horns sprout from the head, twisting and turning in every direction.	false
armory_item_variant_ui_infos_description_wh3_main_dae_cha_daemon_prince_head_dreads_01	Perilously long locks of hair fall from the head, matted into thick ropes that writhe with a mind of their own.	false
armory_item_variant_ui_infos_description_wh3_main_dae_cha_daemon_prince_head_dreads_02	The hair lies behind two long, raised horns that curve sensuously towards the tip.	false
armory_item_variant_ui_infos_description_wh3_main_dae_cha_daemon_prince_head_dreads_03	Hooks sit nestled in the flesh of the chin, attached to decorative chains of metal.	false
armory_item_variant_ui_infos_description_wh3_main_dae_cha_daemon_prince_head_dreads_04	Each individual rope of hair has merged together, forming one braided nest of sentient locks.	false
armory_item_variant_ui_infos_description_wh3_main_dae_cha_daemon_prince_head_dreads_05	An exquisite flowing headpiece is moulded to the shape of the face, covering all but the mouth.	false
armory_item_variant_ui_infos_description_wh3_main_dae_cha_daemon_prince_head_dreads_06	The tips of each twisted rope of hair glow eerily day and night.	false
armory_item_variant_ui_infos_description_wh3_main_dae_cha_daemon_prince_head_fiend_01	The head is thin and elongated into a terrible, horned snout.	false
armory_item_variant_ui_infos_description_wh3_main_dae_cha_daemon_prince_head_fiend_02	Horns stem from the back of the head, snapped asunder by a particularly heavy strike.	false
armory_item_variant_ui_infos_description_wh3_main_dae_cha_daemon_prince_head_fiend_03	Numerous horns sprout from the head in every direction, sturdy, dark and viciously sharp.	false
armory_item_variant_ui_infos_description_wh3_main_dae_cha_daemon_prince_head_fiend_04	The back of the head is armoured in thick, heavy plate, where threatening metal spikes protrude.	false
armory_item_variant_ui_infos_description_wh3_main_dae_cha_daemon_prince_head_fiend_05	At the back of the head hang the skulls and withered body parts of vanquished foes, rattling ominously with every movement.	false
armory_item_variant_ui_infos_description_wh3_main_dae_cha_daemon_prince_head_fiend_06	A long, thin tongue rips through the jaws, regularly dripping with thick saliva. 	false
armory_item_variant_ui_infos_description_wh3_main_dae_cha_daemon_prince_head_helmeted_01	Plain and unadorned, the helm is a basic means of protection and nothing more.	false
armory_item_variant_ui_infos_description_wh3_main_dae_cha_daemon_prince_head_helmeted_02	Once protruding from the helm as two glorious pillars of strength, one horn now stands broken and fragmented.	false
armory_item_variant_ui_infos_description_wh3_main_dae_cha_daemon_prince_head_helmeted_03	The helm has cracked from the crushing punishment of defending against repeated wounding blows.	false
armory_item_variant_ui_infos_description_wh3_main_dae_cha_daemon_prince_head_helmeted_04	Engraved with beautiful, complex patterns, this helm has been sculpted with the finest care.	false
armory_item_variant_ui_infos_description_wh3_main_dae_cha_daemon_prince_head_helmeted_05	The horns have been ripped from this helmet and replaced with macabre trophies of war.	false
armory_item_variant_ui_infos_description_wh3_main_dae_cha_daemon_prince_head_helmeted_06	The dark and corrupting power of Chaos surges through the helm, glowing eerily from the horns.	false
armory_item_variant_ui_infos_description_wh3_main_dae_cha_daemon_prince_head_horror_01	Above a cavernous mouth sits a single eye, its gaze as unsettling as the pointed teeth below it.	false
armory_item_variant_ui_infos_description_wh3_main_dae_cha_daemon_prince_head_horror_02	The head is large and ill-formed, almost swallowed whole by its own gaping jaws.	false
armory_item_variant_ui_infos_description_wh3_main_dae_cha_daemon_prince_head_horror_03	Two long winding horns jut from the gelatinous heap of flesh that forms the head.	false
armory_item_variant_ui_infos_description_wh3_main_dae_cha_daemon_prince_head_horror_04	The horns raise from the top of the head, coursing with magic as indistinct and changeable as the shape of the head itself.	false
armory_item_variant_ui_infos_description_wh3_main_dae_cha_daemon_prince_head_horror_05	A single tentacle trails from the back of the head, smooth and grotesquely swollen.	false
armory_item_variant_ui_infos_description_wh3_main_dae_cha_daemon_prince_head_horror_06	Armour covers the top of the malformed head and nose, protecting the horrors that lie beneath it.	false
armory_item_variant_ui_infos_description_wh3_main_dae_cha_daemon_prince_head_livingarmour_01	The surface of the crude and ugly helm seems to ripple and shift with sentience, whispering dark secrets to its wearer.	false
armory_item_variant_ui_infos_description_wh3_main_dae_cha_daemon_prince_head_livingarmour_02	An enemy mace has smashed a gaping hole into the front of the helm, revealing one menacing eye.	false
armory_item_variant_ui_infos_description_wh3_main_dae_cha_daemon_prince_head_livingarmour_03	The helm is cracked, split by a single, broken horn forcing its way through the metal.	false
armory_item_variant_ui_infos_description_wh3_main_dae_cha_daemon_prince_head_livingarmour_04	Growling and snapping, vicious teeth grow on the front of the helm, alive with their own malicious intent.	false
armory_item_variant_ui_infos_description_wh3_main_dae_cha_daemon_prince_head_livingarmour_05	Two long, swaying tentacles have broken through the shell of the helm curling and twisting of their own accord.	false
armory_item_variant_ui_infos_description_wh3_main_dae_cha_daemon_prince_head_livingarmour_06	The living surface of the helm has mutated two deadly horns at either side.	false
armory_item_variant_ui_infos_description_wh3_main_dae_cha_daemon_prince_head_moon_01	Through extensive mutation, the head has distorted into an unsightly shape, mirroring that of a crescent moon.	false
armory_item_variant_ui_infos_description_wh3_main_dae_cha_daemon_prince_head_moon_02	A long, swaying tentacle grows from the chin, agile and lively with movement.	false
