key	text	tooltip
quotes_quote_onscreen_3678	That which is wrong with the world that we cannot fix with the blades of our axes, we shall surely avenge.	false
quotes_quote_onscreen_3685	New ideas lead to trouble.	false
quotes_quote_onscreen_3688	Hold back your fire and let us pass. We have taken the Slayer's Oath and would pit our axes against those beasts. If we come back, have all your ale ready. If, instead, it is our time to take the Path of Grimnir, then may our doom be a mighty one. If we do not return, remember us to our Clans and Kings.	false
quotes_quote_onscreen_3694	...Thou shalt give unto thine glorious liege the taxes that he requires.\\nThou shalt labour all but feast days,\\nAnd no more than a tenth-share shall you keep for kith and kin.\\nRejoice! For a Knight of Bretonnia provides your shield...	false
quotes_quote_onscreen_369644640	Men don’t like it, but I find a good squeeze of rats’ blood into the hair and beard keeps the Skaven’s noses confused. Longenough for you to get your axe into their brains, anyway.	false
quotes_quote_onscreen_3701	...That which is sacrosanct I shall preserve,\\nThat which is sublime I will protect,\\nThat which threatens, I will destroy,\\nFor my holy wrath will know no bounds...	false
quotes_quote_onscreen_3706	...I set down my lance, symbol of duty. I spurn those whom I love, I relinquish all, and take up the tools of my quest.\\nNo obstacle will stand before me. No plea for help shall find me wanting. No moon will look upon me twice lest I be judged idle.\\nI give my body, heart and soul to the Lady whom I seek...	false
quotes_quote_onscreen_3711	...When the clarion call is sounded, I will ride out and fight in the name of liege and Lady.\\nWhilst I draw breath the lands bequeathed unto me will remain untainted by evil.\\nHonour is all. Chivalry is all...	false
quotes_quote_onscreen_3718	Known as the Slayer of Monsters, Gilles fought and killed many of the great beasts that stalked the Massif Orcal, mounting their heads on the walls of his fastness.	false
quotes_quote_onscreen_3725	Tales are still told of how Lambard stood alone against hordes of Orcs and saved his dukedom of Carcassonne. Steeled by his bravery, those around him fought with the courage of the Breton himself.	false
quotes_quote_onscreen_3735	Unmatched was Landuin of Mousillon’s skill and prowess. His finesse with blade and lance were beyond compare and his bravery, horsemanship and chivalry above all others. Alas, Mousillon hath faded…	false
quotes_quote_onscreen_3736	In the glory of the charge was Balduin most alive, and though others more tempered by the fires of war better controlled their ardour, he was ever in the forefront of battle.	false
quotes_quote_onscreen_3739	With a heart of stone and resolute temper Beren stood unbowed, and with each sweep of blade and thrust of lance, foeman’s blood would spill.	false
quotes_quote_onscreen_3744	Following the loss of his beloved to the curse of a hag, Duke Corduin of L’Anguille became known as the Hermit-Knight. Though when called to arms, he would always return to fight for his beloved king.	false
quotes_quote_onscreen_3751	A master of the feint and riposte, Agilgar’s skill at turning an enemy’s strength against him is legendary. Many a powerful foe met his demise on the end of Agilgar’s lance.	false
quotes_quote_onscreen_3758	Chaste, honourable and untainted by notions of self-aggrandisement, Duke Rademund was one of the Lady’s most virtuous champions, upholding her honour throughout the land.	false
quotes_quote_onscreen_3761	Most loyal of Companions, brave Duke Thierulf of Lyonesse fought at his liege’s side always, and did lament most painfully when the Breton did fall…	false
quotes_quote_onscreen_3769	Great was Duke Folgar of Artois’ skill with a lance – none could unhorse him, save perhaps Landuin himself.	false
quotes_quote_onscreen_376981994	We raid other lands for the gold and flesh to sustain our kingdom. The weak suffer so the strong may survive, that is the way of the world and we are its finest predators.	false
quotes_quote_onscreen_3771	No matter the odds, Marcus took to the field of battle undaunted by the numberless hordes of his enemies.	false
quotes_quote_onscreen_3780	Haughty, proud and skilful, Carleond of Couronne took never a backward step in the face of adversity.	false
quotes_quote_onscreen_3786	Though a dozen or more steeds were shot from under him on the battlefield of Aquitaine, Fredemund never lost his contempt for those that eschewed the martial values of meeting one’s foe face-to-face.	false
quotes_quote_onscreen_3788	A champion of the common man, Martrud was beloved by those he protected. Wherever he fought, the peasants doubled their efforts and would fight to the death rather than dishonour their Lord.	false
quotes_quote_onscreen_3798	I swear by the Zhufbar foundry, but I've tried those new Bronzebeard cannons and they're solid. If you asked me to hit a Giant's eye at a half mile distance I'd have asked you which eye... 'cos I could do it easy.	false
quotes_quote_onscreen_3802	Dum Gribban - Az Baraz Ullekssons-za!\\n(Doom is upon you - the Axe Promise of Clan Ullek has come!)	false
quotes_quote_onscreen_3810	Yinlinsson Gorug Skuf\\n(Clan Yinlinsson has been drinking and is ready to fight!)	false
quotes_quote_onscreen_3813	They might look like trappers, and frankly, they smell even worse than that, but when it comes to ridding the mountainsides of Orcs, there are none better!	false
quotes_quote_onscreen_3816	Thwoppa, Thwoppa, Thwoppa - the rhythmic beating of great rotor blades grew in intensity until a squadron of Gyrocopters passed close overhead. Not long after came the whistling drop of ordnance plummeting from on high, followed by a thunderous blast. Then came the hissing of steam guns and the wails of the dying. Our mine was saved - the Aircorp of Zhufbar had arrived!	false
quotes_quote_onscreen_3824	The gods have seen fit to populate the Old World with all manner of foul monsters. They've also seen fit to grant me a keen eye and a strong bow to hunt them with.	false
quotes_quote_onscreen_3826	The Siege of Altdorf was my first battle, and damn near my last. See this scar, and this? My empty sleeve, this wooden leg, and this patch where my eye should be?	false
quotes_quote_onscreen_3833	They might look like an undisciplined rabble to you Sergeant, but a man fights twice as hard when he's defending home and hearth.	false
quotes_quote_onscreen_3835	Reiksguard Knights, your Emperor is calling! Death or glory awaits us, but if we die, we will die as warriors, with swords in hand, and there can be no better death than that.	false
quotes_quote_onscreen_3839	Three things make the Empire great: faith, steel and gunpowder.	false
quotes_quote_onscreen_3847	Volkmar. Just look at him. He never wavers and never yields. Some say he never even sleeps. Everything about him is bent to that one great task of holding back the darkness. He can't do it alone, but then again, he doesn't need to, for his sheer resolve inspires men like us to greatness.	false
quotes_quote_onscreen_3848	They were already over the walls before the guards knew they were there. The town was destroyed and half the population was carried off to the forest...	false
quotes_quote_onscreen_3860	By all means, try and stop 'em. I won't stand in your way. Beat them back, chop them down, hold the line, carry the day. Cover yourself in glory, or in guts, it makes no difference to me. Or to the dead, for that matter. You're just postponing the inevitable, lad. Mark my words, they'll get us all in the end.	false
quotes_quote_onscreen_3869	I did not see - none of us saw. The arrows flew as from the very trees themselves. My men, they fell, and my legs allowed me to escape. Or did they? Their unfailing accuracy leaves only the conclusion they let me escape, so that I would know…	false
quotes_quote_onscreen_3876	No man is born so unnatural that his body does not revolt at the foul pollution of Undead blood. And by these marks can you tell them: by the fangs of the predator, for their thirst for blood and flesh is like that of a vile beast; by their porcelain white skin, cold to the touch and unnatural to the eye; by the glow of their eyes, behind which lives the terrible Hunger. These are the marks of the Vampire.	false
quotes_quote_onscreen_3880	Fear me, mortals, for I am the Anointed, the Favoured Son of Chaos, the Scourge of the World. The armies of the Gods rally behind me, and it is by my will and by my sword that your weakling nations shall fall.	false
quotes_quote_onscreen_3889	Is not the only constant in the universe change? One day all this will be dust, and even the stars above will flicker and grow dim. Your life is but a tiny candle in the darkness, and your death an afterthought, shorn of meaning by its insignificance.\\nCome, little one, and let me show you how brightly your flame can burn...	false
quotes_quote_onscreen_3896	I have been chosen for greatness by the Dark Gods themselves. You, petty mortal, have been chosen only for death.	false
quotes_quote_onscreen_3906	Face me if you dare, stunted whelp, or do you lack even an Elven maid's courage? I thought the Sons of Grungni were great warriors, but perhaps you are no true Dwarf. Indeed, maybe you are instead some breed of bearded Goblin, though in truth I have seen a finer beard on a Troll's back-side.	false
quotes_quote_onscreen_3909	KILL FOR KHORNE! KILL FOR KHORNE! KILL FOR KHORNE! KILL FOR KHORNE!	false
quotes_quote_onscreen_3914	Horrors are Pink, Horrors are Blue. Where once there was one, now there are two!	false
quotes_quote_onscreen_3922	One way or another, child, Chaos will open your eyes. That I promise you.	false
quotes_quote_onscreen_3927	Oh, fecund life! Oh, blissful plague! To be a host to a thousand tiny lives! To be the bearer of a thousand horrid deaths!	false
quotes_quote_onscreen_3929	Always remember that von Kessel. Act thoughtfully, act intelligently, and act boldly, but always remember to act!	false
quotes_quote_onscreen_3930	And if I hear you publicly doubt yourself again, I will kill you myself.	false
quotes_quote_onscreen_3940	If your Emperor demands your service, then you will damn well serve. Or you will hang.	false
quotes_quote_onscreen_3947	In Sigmar's name, I will cleanse you from this world!	false
quotes_quote_onscreen_3949	Less talk. Let your blades speak for you.	false
quotes_quote_onscreen_3959	The Nordland men have been fighting this war long before the Reikland princes took the throne, and we will be fighting here still, long after it slips through their fingers.	false
quotes_quote_onscreen_3969	Fun. But not so much that I want it to last all night.	false
quotes_quote_onscreen_3972	Well, well. I think I should save you until last, don't you, Dwarf? Let you see your friends die.	false
quotes_quote_onscreen_3974	He may not have loved me the most; that honour, I am certain, went to Isabella, but he certainly loved me the longest.	false
quotes_quote_onscreen_3984	Konrad… is… betrayed…	false
quotes_quote_onscreen_3992	Sorry to disappoint you, but it seems I am still very much alive.	false
quotes_quote_onscreen_4002	Ah, but the truth is like an expensive whore, Jerek. She comes in many dresses and will bend over for any with the money to pamper her.	false
quotes_quote_onscreen_4008	Surrender and serve me in life, or die and slave for me in death.	false
quotes_quote_onscreen_4014	Stick 'em wiv arrers. Stick 'em with knives an' swords an' spears. Stick 'em quick and stick 'em where it 'urts. But most of all, stick 'em when they's lookin' the other way.	false
quotes_quote_onscreen_4020	Let 'em tell da king. Da east belongs to da Orcs. Da east belongs to Morglum. Da east is green.	false
quotes_quote_onscreen_4028	There ain't nowt a cannon can do that a determined Dwarf with a hammer can't achieve.	false
quotes_quote_onscreen_4038	Manling coins are like their words: never trust them. Use your weighing scales and keep your axe handy!	false
quotes_quote_onscreen_4042	Put your trust in stone and iron - stone and iron have always been true friends of the Dwarfs.	false
quotes_quote_onscreen_4045	We are the masters of night, and humans are but our cattle. While we walk upright, they're on their knees.	false
quotes_quote_onscreen_40494523	I am Malekith! Son of Aenarion, the Daemons’ bane. Hear my name and know me, the rightful king of the Elves!	false
quotes_quote_onscreen_4051	Blood for the Blood God! And Skulls for his throne!	false
quotes_quote_onscreen_4055	Fill the moat with the corpses of your comrades. Trample on their broken carcasses to reach the ramparts. Bring down the walls with the weight of the dead.	false
quotes_quote_onscreen_4064	Burn! Burn with the fires of Change! Scream your hymns to Tzeentch!	false
quotes_quote_onscreen_4072	Be vigilant and strong. Who knows what evil lurks in the vacillation of a weak fool?	false
quotes_quote_onscreen_4079	I think there's too many of them this time.	false
quotes_quote_onscreen_4092	There are no problems that cannot be solved with cannons.	false
quotes_quote_onscreen_4096	All life consists of highly organised matter, governed by the laws of nature. Thus all life is a struggle against Chaos, a struggle that is ultimately destined to be lost.	false
quotes_quote_onscreen_4103	No man can be judged until he stands alone before his god.	false
quotes_quote_onscreen_4107	The Daemons of Chaos can be likened to hungry and rabid wolves. The shepherd should not waste his time hating the wolf that attacks his flock. He should simply kill it.	false
quotes_quote_onscreen_4109	At some point in his life, every man finds himself confronted by the reality of evil. The test comes in whether he is willing to face it unflinching, or turn aside and by his inaction let that evil prosper.	false
quotes_quote_onscreen_4115	It is better to take your own life than to fall into the hands of the Kurgan.	false
quotes_quote_onscreen_4122	The Chaos Wastes are bleak and barren beyond compare. But this desolate nightmare still teems with unholy life. The Dark Gods use it as a breeding ground for all that is evil and blasphemous. No matter how many abominations we destroy, the Chaos Waste spits out more than before.	false
quotes_quote_onscreen_4127	How does an Averlander tell a difference between his woman and his cattle? He can't!	false
quotes_quote_onscreen_4129	Quick thinkin' makes for fast mistakes.	false
quotes_quote_onscreen_4135	Why do we raid your lands? It is the will of the Gods.	false
quotes_quote_onscreen_4137	There is nothing if there isn't war.	false
quotes_quote_onscreen_4147	Tradition must be respected, for it is the voice of our ancestors.	false
quotes_quote_onscreen_4157	Typical Goblin weapon, a great bouncing mouth that will eat anything it happens to land on. No subtlety to it, no innovation, no invention. Still, a crossbow bolt or two will see to them alright.	false
quotes_quote_onscreen_4161	It's a game, yes, but there are rules. There are always rules, except for us.	false
quotes_quote_onscreen_4171	Today is a good day to be dead.	false
quotes_quote_onscreen_4177	I don't torture you because I enjoy it. I do it because I need you to understand what I am capable of, because I need you to be afraid.	false
quotes_quote_onscreen_4184	This land is my home, my birthright. The wind and rain are my allies. The trees and stones are my foot soldiers. The very earth will rise up against you should you try to take it from me. And my people will feast on your bones.	false
quotes_quote_onscreen_4188	Oi! Snebber! Woz you lookin' at my choppa? Wot? Howzabout you looks at it a bit closer eh? Yeah? Yeah? Eat dis!	false
quotes_quote_onscreen_4194	Gork and Mork made da Goblinz for us to kick, kill, and eat. Dey iz nothing. Dey iz less than nothing. Even dere magic iz weak an' pointless. Only use Dey got in a fight iz catchin' Humie arrows. Wiv der 'eads.	false
quotes_quote_onscreen_4244	And in that time of darkness Man became Beast, and Beast became Man.	false
quotes_quote_onscreen_4246	The Beastmen: they consume order and spit out Chaos in its place.	false
quotes_quote_onscreen_4251	I looked up into the sky and there I saw my doom, lithesome yet dread. What creatures were these? How many tortures would I endure before peace was mine? A thousand wretched forms united only by a hatred that never ends. Malign and savage to the last, they brim with bitterness for the works of man.	false
quotes_quote_onscreen_4255	Stamp and trample! Gore and crush!	false
quotes_quote_onscreen_4258	A seething, roaring, stinking mass of hair and muscle, sprinting and bounding towards us...	false
quotes_quote_onscreen_4268	We heard it first. Wailing and mewling. Growling and fading. The trees bucked and cried and I thought they tried to pull up their roots and flee from what drew near. Would that we had been so wise...	false
quotes_quote_onscreen_4275	Shoot it down! For the sake of Sigmar, reload, reload!	false
quotes_quote_onscreen_428096531	There are nobles and seamen in the Reikland fleet; but, the seamen are not very noble, and the nobles are certainly no seamen.	false
quotes_quote_onscreen_4285	Then came one they called Gibberkin. No fouler thing have I ever witnessed.	false
quotes_quote_onscreen_4292	Their walls will fall. Their faith will fail. Their flesh will tear.	false
quotes_quote_onscreen_4297	From the darking woods they come, on cloven hoof and twisted claw. The Beastmen they are called, these ones; less than human, yet also something more.	false
quotes_quote_onscreen_4307	One fell night when Morrslieb leered fat in the sky, Heinrich's body came to resemble that which festered in his soul like a rotting wound, an unhealed scar. Every beast in the village whickered and shrieked in fear that night, but Heinrich's screams were loudest of all, for Morrslieb's caress is not gentle.	false
quotes_quote_onscreen_4312	If we run, they will claw us into the dirt and their hounds will gnaw the gristle from our bones. If we surrender, they will bind and bleed us, and Minotaurs will feast on our flesh. If we fight, they will hack and rip and bite and butcher, and they will swallow our still-beating hearts. So many deaths. Which will we choose?	false
quotes_quote_onscreen_4317	And so did the fair village of Sternburg come under the hateful, greed-filled gaze of the Beast. Intent these foul Beasts were of naught but the spilling of blood, the burning of houses and the butchery of all. Mayhap they wished to gather foodstuffs and drink, but I believe this beyond their bestial intellect. A night of terrors and tragedy it was for the people of Sternburg...	false
quotes_quote_onscreen_4325	Powerful was its stature, tall and curving were its horns, and filled with hatred and cunning were its eyes, glowing in the night. It lashed about with a barbed whip, the touch of which cut and tore. With a roar, it pointed, and a pack of nightmare dog-beasts turned their feral attention towards me.	false
quotes_quote_onscreen_4334	You may have felled the trees. You may have built a wall. But these are the blood-grounds of the Beastmen. They will not rest until your homes are ground beneath their hooves and your chewed flesh is rotting in their guts.	false
quotes_quote_onscreen_4337	Really the only question is: what gets to eat you?	false
quotes_quote_onscreen_4343	All around me, they are talking, whispering. Put out their eyes, pluck out their filthy tongues, still they talk, always taunting. Braying in the fields, they plot, they approach in the night, drawing always nearer. They come!	false
quotes_quote_onscreen_4352	And then, the Beastmen were upon us - breaking apart our cannons like they were matchwood. As you can imagine, we ran, lest the disgusting mass consumed us. Only Sigmar knows how we made it to safety, but some were not so nimble in their escape, and paid - screaming - with their lives.	false
quotes_quote_onscreen_4354	Never have I seen such a heaving mass of tusk and flesh, appearing as if from nowhere and careening towards us with truly wild abandon. We had no chance, and I am only alive to speak of it because - to my eternal shame - I ran like a craven coward from the slavering herd.	false
quotes_quote_onscreen_4358	The hellish, slavering Beastmen warherds are the very embodiment of darkness itself - the Realm of Chaos made manifest.	false
quotes_quote_onscreen_4368	Within my library there is all knowledge - of gods lost and new, of tyrants and heroes, of lost cities and civilisations... and forbidden lore. Yes, there is wisdom that should not be learnt by the likes of me or you. And yet... shall we take a peek?	false
quotes_quote_onscreen_4375	They call me mad - mad! But 'twas I who stopped those invading unicorns. None other! Mad indeed…	false
quotes_quote_onscreen_4384	I realised, as my brush drifted over the canvas, that I was no longer painting the likeness of a man, of an Emperor, but of Sigmar himself - reborn!	false
quotes_quote_onscreen_4386	The riving flow of Chaos must be met with order. The purge of heresy and the restoration of civility. Those harbouring impure thoughts must be washed away by the cleansing flame; it is the only way.	false
quotes_quote_onscreen_4391	They say of Marienburg that a man can find whatever he wants amongst the madding throngs. They also say that a man will almost certainly find what he does not want as part of the bargain…	false
quotes_quote_onscreen_4398	We have gazed upon the forbidden knowledge of ancient men, of wisened scribes, and powerful fools. All have a place within my library. And then, there are the… darker corners… Do we dare?	false
quotes_quote_onscreen_4408	I have unshakeable faith in the percussive power of the Imperial battery. Yet there are things out there, dark and twisted things, that make me wish they fired just a little faster…	false
quotes_quote_onscreen_4410	Did you know that Sigmar himself worshipped Ulric? Yes, yes - so we're all Sons of the Wolf really. Yes, oh yes, he whispers to me, tells me these things. Secret things…	false
quotes_quote_onscreen_4419	Proud Middenheim juts out of the forest atop the Ulricsberg, a proud white lupine fang, defiant. It dares any who would denounce Ulric to try their might; it goads their inevitable failure.	false
quotes_quote_onscreen_4422	A nightmare in the flesh is Helman Ghorst. I saw him once, I did. Ensconced in a cart pulled not by horses, nor demon steeds, but men. And not just any men - his own dead brothers resurrected! Makes you shudder…	false
quotes_quote_onscreen_4428	Where march you, men of Reikland, where carry you halberd and sword? We march to war for our Emperor, our saviour and our lord.	false
quotes_quote_onscreen_4432	Tomorrow we go to war, to face the hosts of Chaos, Tomorrow we will be buried, in cold graves that await us.	false
quotes_quote_onscreen_4436	And when the fighting is done, and the sun goes down at night, Hear my prayer, save my soul, and take me to Sigmar's light.	false
quotes_quote_onscreen_4440	The Emperor can only see as far as his gilded throne in Averland will allow. What the Supreme Elector cannot see, cannot hurt him. Not yet, anyway…	false
quotes_quote_onscreen_4449	And I beheld a great host descending; a horde of bodies, not one of them complete. An arm missing here, a leg there, a jaw elsewhere; a desiccated mass of horror, tumbling from the mountainside…	false
quotes_quote_onscreen_4455	At the zenith of our ancient power, it was a wonder to the world; more beautiful then even Everpeak, open to the sky. A sign of our wealth and power, strong beyond the measure of all. We thought it would never fall and the mines would be ours forever...	false
quotes_quote_onscreen_4456	What fools we were. In pride we built Eight Peaks, sure of our mastery of stone and the dark beneath the world. Yet even as we built the city, the seeds of its doom were planted.	false
quotes_quote_onscreen_4464	We were weary of war when the Black Mountains belched forth their cloud of ash; our people had returned to the safety of their cities. Yet from the heart of our realm, from the place we imagined ourselves the strongest, the foe burst forth...	false
quotes_quote_onscreen_4473	From the tunnels far below any we had dug, our enemies struck into the core of the fortress. Through the mines that had been the source of our wealth poured armies of Goblins and rat-like Skaven and things far, far worse…	false
quotes_quote_onscreen_4482	When we first came here we numbered five hundred, with a few mannish allies. The only perils we faced were the Orcs and their followers. We cleared this keep and parts of the upper city as a prelude to reclaiming our ancient mines.	false
quotes_quote_onscreen_4491	Ach, manling, you have some inkling of how far we have fallen. The days of our glory are behind us. Once we created all this. Now we huddle in a few shrunken cities and wait for the end of the world.	false
quotes_quote_onscreen_4499	The day of the Dwarf has gone, never to return. We crawl like maggots through the work of elder days and the glory of what once was ours mocks us today.	false
quotes_quote_onscreen_4501	Make sure you tell all those humies, humie, make sure you tell ’em good, make sure you tell ’em about the king in da mountain. Tell ’em all about me, Skarsnik, tell ’em all about my life, leave nuffink out.	false
quotes_quote_onscreen_4511	Dat’s what I want, a good story, cos I am going to tell you a good story. An’ I want you to tell all da uvver ’umies out dere who the biggest and meanest and bestest Goblin in the world is, you got dat? And if you don’t do it in pretty words den I’ll come and eat your liver while you watches, got dat?	false
quotes_quote_onscreen_4515	When da runtboss told us to work, I’d set me gang up and sneak away. We’d be down dere days, sometimes, and as long as I came back wiv da goods, it didn’t matter. I’d see fings… incredible fings.	false
