key	text	tooltip
#Loc;1;text/db/quotes__.loc		
quotes_quote_onscreen_1004609557	There's something big down there, in the depths… something cold, and black o' heart. Worse still, I got me a feelin' it's out to get us, and me in particular. Axes, lads; looks like we're in for a proper fight after all!	false
quotes_quote_onscreen_1004794420	Revered One, Venerable One, Lord of Secrets, High Priest of the Temple of Years, Keeper of the Pyramid of Eternity, Interpreter of Mysteries, Prophet of the Lord of the Tomb, Master of Awakenings, Bearer of the Serpent Staff, Khatep, the Enduring.	false
quotes_quote_onscreen_1005405991	We will weave your bloodied hair into the tapestries of the council chamber!	false
quotes_quote_onscreen_1017089362	In the jungles to the east and south of here, there is a temple. An edifice stained in the blood of a thousand generations and haunted by the spirits of those who died screaming on its black altars.	false
quotes_quote_onscreen_1019880929	I shivered at the sight of her – her beauty far beyond that of mortal man. But her soul glowed with an inner darkness that chilled my very core.	false
quotes_quote_onscreen_1025618649	You four. Yes-yes, you. Go to city quick-quick, kill Man-thing at Warp-tower. Bring back…	false
quotes_quote_onscreen_1089592707	Swimming with Manann	false
quotes_quote_onscreen_1093190507	Warp… must have Warpstone, yes-yes… catch it, catch it! Sniff it out… give it to Vampire, yes, but not all of it, not all… no-no, Skretch keep… keep some for himself… Must… feed…	false
quotes_quote_onscreen_1100203740	Manann would rather be cursed at with the most horrible of words rather than not be spoken of at all.	false
quotes_quote_onscreen_1118757594	It is better that every High Elf be condemned to hell than that idiot king plague them any longer, kill him, kill him for the good they know nothing of.	false
quotes_quote_onscreen_1119071705	Now you return from the blighted edges of the world carrying a blade that was forged by Caledor and borne by Aenarion himself. I can almost feel the forces of destiny lining up behind you.	false
quotes_quote_onscreen_1120468241	Tyrion is the soul of charm. People like him. He knows how to put them at ease.	false
quotes_quote_onscreen_1124339992	And they will rise from their graves to march upon the world of the living. Each and every mortal that falls will swell their numbers until only a world of darkness remains. Only then will the world know of the eternal order that lies within the peace of Undeath.	false
quotes_quote_onscreen_1124750909	Leeches! Mosquitos! Poisonous Spiders! Blinding clouds of Gnats! Snakes! Thanqoul's fur crawled as he thought of the snakes. The loathsome things were everywhere, watching them with their unblinking eyes, sniffing at them with their forked tongues. He'd lost count of all the hideous snakes they'd seen!	false
quotes_quote_onscreen_112991627	Take their gold, burn their homes, kill their families and enslave their souls. Show them no mercy.	false
quotes_quote_onscreen_1131787186	My father, the Phoenix King, said that one should always choose the lesser of two evils. How best to discern which is which…	false
quotes_quote_onscreen_1137888507	That damned blood-sucking dog wants us to stay on the outside of his little wall. Reason enough for us to go in, I say.	false
quotes_quote_onscreen_1139669904	We have been blessed and in His name we shall bare our blades in readiness for His will as voiced by His avatar. Hail Malekith, Eternal Khaine Incarnate!	false
quotes_quote_onscreen_1153279172	Seven Phoenix Kings had now died, and Malekith had seen them all pass, his life sustained by dark energies. The Witch King vowed that he would survive to see the last Phoenix King perish, even if he had to wait until the end of all things!	false
quotes_quote_onscreen_1157169318	He is greedy. Rapacious, even! Throwing sacrifices to him is like tossing gold and offerings into a bottomless pit. There is a reason that the sea is so vast—it is the belly of Manann, the ever-hungry.	false
quotes_quote_onscreen_1163932058	WANTED!... For expedition to the mysterious east... Willing freebooters of good reputation and proven ability. Tropical experience an advantage. Interested captains to present themselves to General Blackheart at the Reaver's Return Inn, Dockside!	false
quotes_quote_onscreen_1194770426	Kill their soldiers, kill their wives, kill their children, their cattle and livestock, but above all, kill with pleasure.	false
quotes_quote_onscreen_1210849663	When you look at your foe, do not see another Elf. See them for what they are; creatures less than animals. 	false
quotes_quote_onscreen_1218943629	We lived in the Great Desert for centuries and we were content. Then came Settra, the Empire-Maker, and we were sorely tested.	false
quotes_quote_onscreen_124182450	Hail bright flower of the goddess, chosen of Isha. Dawn's hope and heart's home; the glory of Ulthuan shines in your eyes!	false
quotes_quote_onscreen_125408697	One of them flimsy Elf vessels, looks like! And in deep trouble. What say, lads, shall we show those pretty-boys how a proper warship fights? Or should we leave those pointy-eared lackwits to the death they so richly deserve?	false
quotes_quote_onscreen_1270125604	The Tileans claim they have sailed the world. They talk of trading with lands so distant that we folk of Sigmar’s Empire could not even contemplate their existence.	false
quotes_quote_onscreen_1294502652	In strange aeons, even death may lose its grip and though I march to the tomb, I have the spirit of a king! And you also, yet you be but mere mortals, you have the invincible spirit of the army of Settra!	false
quotes_quote_onscreen_1296782689	Warpstone fire can not only consume a substance, but actually change it’s structure to far more than just ‘burned’ due to exposure to it’s holy flames. Weapons made from Warpstone produce their own poison. A Warpstone charm brings real luck, changing what ‘was to be’ to what ‘might have been’ with none the wiser.	false
quotes_quote_onscreen_1300621424	In that dread desert, beneath the moon's pale gaze, dead men walk. They haunt the shifting dunes of the breathless, windless night, brandish weapons of bronze in mocking challenge and bitter resentment of the life they no longer possess.	false
quotes_quote_onscreen_1304406635	Kill-kill, quick-quick!	false
quotes_quote_onscreen_1308803039	And behold, the almighty god-king Settra did awaken from his sleep of blessed oblivion. His legions, long buried beneath the sands, did arise and stand to attention, awaiting his order. And he did say "War!", and the world did tremble.	false
quotes_quote_onscreen_1321615935	Beware the guardians of the Underworld who stalk among us!	false
quotes_quote_onscreen_1323793045	Skryre’s most powerful Engineers meld sorcery and science until the two are indivisible. These individuals are called Warlock Engineers, and they are more akin to walking arsenals than Skaven. Warp-energy crackles from the blades that emerge from the flesh of their arms, and their rat-like bodies are covered in all manner of bizarre artifice.	false
quotes_quote_onscreen_1328054953	Technology is just a fancy word for engineering that don’t work.	false
quotes_quote_onscreen_1352439874	All for one and ever man for himself!	false
quotes_quote_onscreen_1406848080	I know you, fiend. You killed my wife, my father, and my only son. You may yet kill me. But by Sigmar, I will drag you and your Undead scum screaming to hell with me…	false
quotes_quote_onscreen_1414760801	Hmm... What an interesting anomaly. The details of the coastline suggest an inlet along this stretch. Perhaps we could land there and I could map out the interior?	false
quotes_quote_onscreen_1430018345	And lo, he shall rule with a dark hand and his shadow shall touch upon every land. Steel will be his skin and fire will be his blood, in hatred will he conquer all before him. No blade forged of Man, Dwarf or Elf shall endure him fear. 	false
quotes_quote_onscreen_1435843866	The War of the Beard. Elven pride and Dwarfish stubbornness ignite a war that will blaze for centuries to come.	false
quotes_quote_onscreen_144398448	Now make ready your weapons, my soldiers, for the time is at hand. Go forth, I command you go forth in haste and march with your king into the darkness of the tomb. Make great the name of Settra and Khemri! 	false
quotes_quote_onscreen_1448058341	As soon as their jolly boat touched the sand they roared ashore, charging the waiting Goblins. It was a short fight. Within moments the Greenskins were running for their lives and the pirates were rewarding themselves with a swift tot of rum!	false
quotes_quote_onscreen_1452467645	All knew that to wield Khaine's blade was to invite death, damn your soul and doom your lineage for evermore.	false
quotes_quote_onscreen_1452577109	You are mine, Alcadizaar. Together we shall rule Nehekhara until the end of time.	false
quotes_quote_onscreen_1453233169	Kill-Kill!	false
quotes_quote_onscreen_1456375872	The ladder of Naggarothi society has very greasy rungs; few make it to the top.	false
quotes_quote_onscreen_1472399892	If the ignorant must be slaughtered to destroy the truly wicked, then so be it.	false
quotes_quote_onscreen_1473196788	Do not long for peace, for there can be none while any Druchii still draw breath.	false
quotes_quote_onscreen_150333534	Look upon my flesh, my warriors! Once I was a mighty warrior-king destined to live the life of a god, yet my flesh withers upon my bone, my frail body succumbs to the ravages of time and soon death will claim me. But it shall not always be so.	false
quotes_quote_onscreen_1508544016	The endgame is upon us. Fetch the prize, my children, and we shall teach these upstart mortals what it means to defy the Dreadfleet."	false
quotes_quote_onscreen_1531721838	I awoke to the prodding of a bronze headed spear, clutched in the hand of an armoured skeletal warrior. I’ve have seen such sights in my days that I’m all but jaded to terror, but being awoken by one of the Undead surely took another year or two off my life.	false
quotes_quote_onscreen_1535414752	You know the old superstition about not looking back at port? Well the same goes for Marienburg - so long as we stare out to sea and don’t look back, Manann will protect us.	false
quotes_quote_onscreen_1540284863	Tell-say that Ikit Claw, Chief Warlock of Clan Skryre, Master of the Warpstorm, Flayer of Forgemaster Gharhakk Bloodtongue, Butcher of Chicomecoatl, Gutter of Jarl Alfhild Daemonkin, Burner of Magister Klaus von Doenhoff, Razer of Helwigstadt...	false
quotes_quote_onscreen_1553661902	The Skaven are smarter than they look. Don’t mistake them for being stupid - nor for cowards, neither. The reason they run is because the surface isn’t their home ground. They only fight when they’ve got the advantage: underground, in the dark, and with far superior numbers. In fact, if the Skaven attack, you know you’re in trouble...	false
quotes_quote_onscreen_15826701	Their leader, who was bedecked in feathers, edged towards me. It was I who spoke first: "Salaam, brother, we come in peace!" He spoke to me in his own tongue which I could not understand. It was time to delcare the reason for our entry into his land before they decided to attack us...	false
quotes_quote_onscreen_1595103152	Sentinels at the portal of eternity, mighty ones who stand before the king, valiant heroes whom none shall pass, guardians of the king's tomb.	false
quotes_quote_onscreen_1595391395	Hesitation is death, doubt is weakness.	false
quotes_quote_onscreen_1600003644	They don’t feel fear as we do, or if so, they hide it well. I saw one take on a Griffon without hesitation when it came too close to his eyrie, and I’ve heard tell that the mothers will even assault a Dragon if their chicks are threatened!	false
quotes_quote_onscreen_1602391211	"Attend to the gates!" All present knew what this meant. All knew that this was the one great pressing task to accomplish and that it would take forever.	false
quotes_quote_onscreen_1644071958	They come from the sea, and the sky and Great Desert, from the jungles and the mountains. They pour forth in a limitless tide and are broken on my walls.	false
quotes_quote_onscreen_1647312838	In Numas, life has returned to the desert and once again crops grow around the city. Numas is a marvellous place, and over many centuries the pyramids have been restored to their former glory.	false
quotes_quote_onscreen_1650511415	He cast his good eye over the weary regiments, their captains to the fore awaiting orders. Blackheart noted them all, creatures of many races all driven to serve an insatiable lust for adventure, glory and... most of all gold! He would give them gold!	false
quotes_quote_onscreen_1655304629	They can be as fierce as a northern storm and just as swift if they’ve a mind to. When they dive, if you blink, you’ll lose sight of them.	false
quotes_quote_onscreen_1677602893	A scratch from an envenomed dagger, a sip from a poisoned chalice, a slight to a proud warrior's honour… In time these things may do far more grievous harm then the broadsword or axe, my love…	false
quotes_quote_onscreen_1683088675	Outnumbered and ill-prepared, the High Elves were slaughtered. As the survivors fled eastwards on waters turned crimson by the blood of their fallen comrades, the Witch King drew plans for a new invasion of Ulthuan.	false
quotes_quote_onscreen_1689925560	It is a worthy life. I get to regularly practice my skills upon our many enemies and one tenth of the plunder that I seize is mine to keep. Slaves, gold, and fame, these too can be yours if you are bold.	false
quotes_quote_onscreen_1724712041	Can’t you hear them? The scratching? The skittering? The squeeking? They are under our very feet!	false
quotes_quote_onscreen_1728391275	While lesser races must study magic in its corrupted, broken form, our Mages harness its power as pure mythical energy.	false
quotes_quote_onscreen_1752077311	Thus will the Dark King fall, slain by neither blade nor arrow but by a sorcerous power of darkest magic and so shall his body be consumed in the flames and for all eternity burn.	false
quotes_quote_onscreen_1763385570	You stand before me ready to fight and die for your homeland, and that makes me proud of each and every one of you!	false
quotes_quote_onscreen_1767993871	Then let it be so. From this day forwards, you are one of the bani-al-Hashim.	false
quotes_quote_onscreen_1775550551	Tubes and wires pulse and buzz with unholy life as they connect the Engineer to his harness and its fantastic apparatus. Fearful and horrible indeed is Skryre’s technology if it allows such an unholy alliance of flesh and machine.	false
quotes_quote_onscreen_1789952002	If you come to treat with me, hear my oath to the dead. Nothing is forgotten, nothing is forgiven!	false
quotes_quote_onscreen_1793343258	Be prepared to sail by the first week of the harvest tide, on a sea voyage of no less than six months duration… Interested captains to present themselves to General Blackheart at the Reaver's Return Inn, Dockside!	false
quotes_quote_onscreen_1828754435	So where does it come from? There are those among the more superstitious of our folk and a few foolish Grey Seers that believe Warpstone is the 'leavings' of the Horned Rat. I subscribe to the secular view – that it is chunks of the Dark Moon, Morskrit, gifting us with pieces of its essence. Dangerous it is, to touch Warpstone often. But that’s what slaves are for, yes-yes?	false
quotes_quote_onscreen_1842123076	As the war ground on, the folk of Nagarythe became ever more desperate, relying on the blackest of sorceries and Daemonic pacts. Thus did they come to be known as 'Dark Elves'.	false
quotes_quote_onscreen_1848013794	And every time, she sends with them a token of her affection, one cousin to another. A lock of her hair, a book of poems by a philosopher of our acquaintance, the crown of Lahmia taken from her husband’s head, the amulet of Asaph stolen from my crypt, or... a sword she used to shed my blood.	false
quotes_quote_onscreen_1864311188	Our blood is not for the likes of you! Raise a hand against us and I will scourge the spirit from your worthless bones and hurl you into the Outer Dark! Flee before my wrath, wretched sons of Aenarion! The Dark Mother waits, and if you press me I shall offer your souls up to her!	false
quotes_quote_onscreen_1871055270	The only possible way an attacker can carry one of those accursed stone forts is to advance under the heaviest barrage of missiles possible. This is where the Elf forces archieved their greatest successes; the defenders unable to spread out, are ripe for slaughter beneath a cloud of arrows, and cannot deploy much effective missile fire of their own, hampered by the limited arcs of fire within their walls.	false
quotes_quote_onscreen_1871594933	I stood before the gigantic golden statue at last! Here it was, the legendary Golden Serpent, the greatest treasure in all of Lustria. I alone was left alive to see it. How ironic, I thought, that now I had reached the treasure I no longer possessed the means to either break it up or carry it away.I could at least take back a memento...	false
quotes_quote_onscreen_1902394250	A single Skaven, he is a weakling and a coward. Divide and conquer is the watchword here. In ones and twos, they will always fall under your sword, but in many numbers they will come from all sides, sneak around behind in the dark tunnels, even dropping from above, or crawling from below, and attacking without fear or any caring for their own lives.	false
quotes_quote_onscreen_1925101158	Awake O dead, for there can be no rest for ye beneath the earth. Let the splintered bones burrow from the grave pall. Let cold fingers grip tomb-worn blades, and unseeing eyes survey the fields of slaughter. For your time has come once more. And the dead shall walk.	false
quotes_quote_onscreen_1930420756	We do not do it for coin, for there is none. We do not do it for glory, for there is none also. We do not do it for even thegratitude of the people, nor the soft kiss of a maiden, for the people are too scared to thank us. No, we do it for the screaming of our enemies - and of that, mi amigo, there is a-plenty.	false
quotes_quote_onscreen_1939661777	A tale is told of two Skaven, birthkin from the same breeder. While scouting the woods above their home, they encountered a ravenous Minotaur. Wisely, they fled the beast, but it gave chase and pursued them for many miles. "Surely," said the first Skaven, panting, "we cannot-cannot outrun this horrible creature." The second chittered his agreement. "Nor do we have to," he replied. Unsure of his birthkin’s motive, the first Skaven asked "What do you mean?" By way of response, the second tripped his companion, answering "I-I only need to outrun you!"	false
quotes_quote_onscreen_1963831595	I’ve said all my prayers, offered sacrifices and paid my tithes. My ship is in Manann’s hands now.	false
quotes_quote_onscreen_1969327125	Damn you all! Come ahead then and pour out your blood upon my steel!	false
quotes_quote_onscreen_197530677	Is it possible that the Skaven are no less than a manifestation, a dark and morbid reflection of man's cities, his civilisation, even his fears? Are not the Skaven, their religion, and their foul, dank world not just a growing shadow and a dark twin of mans deep and barren nature?	false
quotes_quote_onscreen_1981666479	The more we study our inner light, the more profound becomes the outer darkness.	false
quotes_quote_onscreen_1992099478	"Aye Father," I said manfully, "it's goodbye to sleepy Wilderheim forever. I go out in fear of my enemies but to a new life of adventure, fame and fortune!..."	false
quotes_quote_onscreen_1995934780	Little rats have bigger rats, amongst their ranks to guide ‘em, and bigger rats have giant rats, and so on, ad infinitum.	false
quotes_quote_onscreen_2049160376	The world is ours to rule as we wish.	false
quotes_quote_onscreen_2064968489	And he did smite and destroy his enemies with great vengeance and furious anger.	false
quotes_quote_onscreen_2068477278	Now strangers heed the song of the Brine-Maid, and glimmer they seek as all men may. Multitudes and legions land on sacred shore and make for Lizard-home. I shall steer them to riches beyond dreaming and do mischief to High-Lizard Lordling a-plenty!	false
quotes_quote_onscreen_2092494918	...and storms shall sunder the skies, and war will tear the world apart, and the dead shall rule the lands.	false
quotes_quote_onscreen_2108765834	Manann is our blessing, our patron, the one that brings food to our table. He’s also the one that drags our sons to the bottom of his watery home, the bringer of storms, and the crushing waves. He is the Sea and he is eternal.	false
quotes_quote_onscreen_2111724931	There are great deeds that remain undone, enemies yet to conquer and raptures yet to rejoice in. So, as it is written, so shall it be done. I, Settra, have proclaimed it - let none dare oppose my will! 	false
quotes_quote_onscreen_2115964581	Bow, pilgrims, bow before the Wisdom of Asaph made flesh, the Voice of the Vengeful, the Lioness of the Hills, She Whose Legions Blot Out the Sun With Their Arrows, High Queen Khalida, Guardian of Damned Lahmia, the Watchful Soul and the Serpent Queen. Kneel, so that you might bask in her radiance!	false
quotes_quote_onscreen_2122975836	I’m not sure what those things were, but they fought like cornered… er…	false
quotes_quote_onscreen_2127240838	We were fools. The Ark crushed us, and the Druchii picked off the warriors who flailed about in the frothing waters with arrows. Only I survived. There is nothing worth having to the east. Nothing.	false
quotes_quote_onscreen_2129810176	There is wisdom and there is ignorance, and in between are the gateways to eternity through which the Old Ones so long ago passed.	false
quotes_quote_onscreen_213012347	The fact that the Warlock Engineers sell to all sides in the constant Skaven struggle for dominance is well known; the fact that for a very high price they offer to withhold their services is widely guessed. None but the Grey Seers know the exorbitant extent of Clan Skryre's double-dealing and treachery.	false
quotes_quote_onscreen_224704661	Malekith was caught within the fire, his body terribly scarred and burned. It is said that his screams were so terrible that none who heard them could ever cast them from memory.	false
quotes_quote_onscreen_262057784	We fight for loved ones lost. We fight for futures blighted. We fight to reclaim a land that was once gloried above all others. We fight for Nagarythe!	false
quotes_quote_onscreen_295766987	Lightning shall sunder the skies, the rivers will flow red with blood and war will come to the land! The legions of the long-dead kings shall once more rise eternal in conquest, and death shall ride beside them!	false
quotes_quote_onscreen_298318401	Quick-quick! Move-move! The Man-thing looks away. Strike now!	false
quotes_quote_onscreen_308767221	It’s not that Manann is evil. He is not of course, despite what the yokels might claim. No, Manann is fickle, capricious, and temperamental - much like the weather, in fact.	false
quotes_quote_onscreen_325893137	The Druchii tore your lives from you and threw them upon sacrificial pyres, and anointed their priests with the blood of your kin!	false
quotes_quote_onscreen_331198770	You know me as your king. Know me now also as the incarnate vessel of your lord and god, Khaine the Ruthless, the Bloody-Handed Messenger, Jaguar of the Night, the Manticore. In me has He invested His power in the mortal realm, so that He might lead you on the crusade of death.	false
quotes_quote_onscreen_349401254	Manann be praised, for he is the breeze to take us out; Manann be praised, for he is the wave to bring us home; Manann be praised, for he is the food to feed us; Manann be praised, or his be the wrath that drowns us.	false
quotes_quote_onscreen_3613	Grimgor is da greatest!	false
quotes_quote_onscreen_3623	The only good stunty is a dead stunty, and the only thing better than a dead stunty is a dyin’ stunty who tells yer where to find ’is mates.	false
quotes_quote_onscreen_3630	Everyfing I see is mine. All da uvver bits are mine too – I just ain’t got there yet. When we reach da end of da world, we’ll turn around an’ march back.	false
quotes_quote_onscreen_3636	I’m gonna stomp ’em to dust. I’m gonna grind their bones. I’m gonna burn down dere towns and cities. I’m gonna pile ’em up inna big fire and roast ’em. I’m gonna bash ’eads, break faces and jump up and down on da bits dat are left. An’ den I’m gonna get really mean.	false
quotes_quote_onscreen_3639	For ten thousand kindred dead we swear vengeance against Grimspike Pass. No peace until the mountain is mined to exhaustion and the rocks of the pass are as dust.	false
quotes_quote_onscreen_3648	Ere we go, ’ere we go, ’ere we go!	false
quotes_quote_onscreen_3652	Flank ’em, shoot ’em, hit ’em hard, and then do it again from annuver angle. Of course, if da battle is going bad for our side, I’m gonna keep ridin’ and act like I wuz never there, so yer’d better stick close!	false
quotes_quote_onscreen_3661	If I find out ’oo ate me favourite snottie then there is gonna be sum trouble. I wuz savin’ ’im, I wuz. Ded clever lil’ feller – he could fetchit right quick. ’Course, it wuz never wot I asked fer, but yer could see he wuz eager. Poor lil’ feller.	false
quotes_quote_onscreen_3668	He snores and eats all our gobbos, but dat big lug is handy in a fight…	false
quotes_quote_onscreen_3677	I dunno Boss, I tried to give da Shaman yer orders, but da bug-eyed loon is just talkin’ to that skull wand of his. Da funny thing is, Boss… I fink I ’eard it talkin’ back.	false
